"date","timestamp","session","href","txt"
"2023-04-13","202304130920","morning","https://edition.cnn.com/2023/04/12/asia/north-korea-missile-japan-intl-hnk/index.html","Fear and confusion on the island of Hokkaido after emergency alert system warned millions of residents to take cover "
"2023-04-13","202304130920","morning","https://edition.cnn.com/2023/04/13/politics/pentagon-leaked-documents-military-base/index.html","Pentagon leaker described as lonely gun enthusiast who worked on military base: Washington Post"
"2023-04-13","202304130920","morning","https://edition.cnn.com/2023/04/12/politics/donald-trump-michael-cohen-lawsuit/index.html","Trump sues Michael Cohen for $500 million "
"2023-04-13","202304130920","morning","https://edition.cnn.com/europe/live-news/russia-ukraine-war-news-04-13-23/index.html","Father whose daughter drew anti-war picture extradited to Russia from Belarus"
"2023-04-13","202304130920","morning","https://edition.cnn.com/2023/04/13/australia/cyclone-ilsa-western-australia-thursday-intl-hnk/index.html","Cyclone Ilsa rapidly intensifies as it approaches landfall in Western Australia"
"2023-04-13","202304130920","morning","https://edition.cnn.com/videos/world/2023/04/12/exp-biden-ireland-belfast-osullivan-robertson-041202pseg1-cnni-world.cnn","Biden is in Ireland. See how crowds have been greeting him"
"2023-04-13","202304130920","morning","https://edition.cnn.com/2023/04/13/asia/russia-pacific-fleet-naval-exercise-intl-hnk-ml/index.html","Russian warships conduct anti-submarine exercises in Asian waters "
"2023-04-13","202304130920","morning","https://edition.cnn.com/2023/04/12/politics/biden-northern-ireland-visit-security-breach-intl-hnk/index.html","Police probing security breach around Biden visit after sensitive documents found in street"
"2023-04-13","202304130920","morning","https://edition.cnn.com/2023/04/13/business/jpmorgan-chase-epstein-abuse-allegations/index.html","JPMorgan executives knew about sex abuse claims against then-client Jeffery Epstein, court filing alleges"
