"date","timestamp","session","href","txt"
"2021-03-28","202103281426","midday","https://us.cnn.com/videos/justice/2021/03/27/asian-american-support-rally-stop-hate-salon-letter-vercammen-nr-vpx.cnn","'This is not OK': Salon owner slams racist letter sent to businesses"
"2021-03-28","202103281426","midday","https://us.cnn.com/2021/03/28/us/oklahoma-inmate-killed-held-guard-hostage/index.html","Inmate killed by police held corrections officer hostage and took his radio and keys"
"2021-03-28","202103281426","midday","https://us.cnn.com/2021/03/28/opinions/the-fried-egg-school-of-politics-opinion-weekly-column-galant/index.html","Opinion: Biden's Reagan moment"
"2021-03-28","202103281426","midday","https://us.cnn.com/2021/03/28/asia/indonesia-suicide-bomb-intl/index.html","14 people injured in suspected suicide bombing outside Catholic church"
"2021-03-28","202103281426","midday","https://us.cnn.com/videos/politics/2021/03/26/ohio-candidates-trump-endorsement-politico-keilar-nr-vpx.cnn","Reporter reveals what happened at Trump's secret meeting with candidates"
"2021-03-28","202103281840","evening","https://us.cnn.com/2021/03/28/politics/birx-trump-covid-very-uncomfortable-phone-call/index.html","The then-White House coronavirus task force member recalls a 'very uncomfortable' call with the former President after she spoke about Covid's spread"
"2021-03-28","202103281840","evening","https://us.cnn.com/2021/03/27/politics/covid-war-deaths-preventable/index.html","Analysis: Birx says majority of Covid-19 deaths were preventable"
"2021-03-28","202103281840","evening","https://us.cnn.com/videos/health/2021/03/28/deborah-birx-donald-trump-uncomfortable-conversation-gupta-covid-sotu-vpx.cnn","Dr. Birx: Everybody in the WH was upset about this interview"
"2021-03-28","202103281840","evening","https://us.cnn.com/2021/03/28/health/children-unvaccinated-camp-playgrounds-summer/index.html","Conceivable that unvaccinated children could go to camp or playgrounds this summer, Fauci says"
"2021-03-28","202103281840","evening","https://us.cnn.com/2021/03/28/health/us-coronavirus-sunday/index.html","Disaster or release: America could go either way "
"2021-03-28","202103281840","evening","https://us.cnn.com/videos/health/2021/03/27/fauci-birx-covid-war-gupta-intv-sot-vpx.cnn","Fauci: This may have been the best decision I've ever made"
"2021-03-28","202103281840","evening","https://us.cnn.com/2021/03/27/europe/europe-is-angry-with-itself-intl-analysis-cmd/index.html","Analysis: The pandemic is stirring deep resentments in Europe"
"2021-03-28","202103281840","evening","https://us.cnn.com/2021/03/28/opinions/hard-lesson-dr-deborah-birx-ranney/index.html","Opinion: The hard lesson of Dr. Deborah Birx"
"2021-03-28","202103281840","evening","https://us.cnn.com/2021/03/28/politics/voting-rights-georgia-souls-polls-blake/index.html","Georgia Republicans made two big mistakes when they attacked voting rights "
"2021-03-28","202103281840","evening","https://us.cnn.com/2021/03/28/africa/suez-canal-ship-blockage-intl/index.html","Despite progress, ship remains stuck in the Suez Canal"
"2021-03-28","202103281840","evening","https://us.cnn.com/2021/03/28/politics/julia-letlow-covid-vaccine-republicans/index.html","'Look at my family. Use my story': Rep.-elect Letlow urges GOP to get Covid vaccine after husband's death"
"2021-03-28","202103281840","evening","https://us.cnn.com/2021/03/28/politics/youth-mental-health-biden/index.html","Advocates call on Biden administration to prioritize youth mental health as experts warn of consequences"
"2021-03-28","202103281840","evening","https://us.cnn.com/2021/03/28/us/maryland-cannonball-civil-war-detonate-trnd/index.html","Bomb squad detonates Civil War cannonball found in Maryland"
"2021-03-28","202103281840","evening","https://us.cnn.com/videos/tv/2021/03/28/lee-wong-scars-asian-american-veteran-ohio-orig-kj.cnn","Asian-American veteran reveals scars during meeting, asks 'Is this patriot enough?'"
"2021-03-28","202103281840","evening","https://us.cnn.com/2021/03/28/us/91-year-old-police-officer-no-plans-to-retire-trnd/index.html","He's a 91-year-old cop with no plans to retire"
"2021-03-28","202103281840","evening","https://us.cnn.com/2021/03/28/weather/severe-weather-south-floods-sunday/index.html","Two killed as Nashville is hit by flash flooding"
"2021-03-28","202103281840","evening","https://us.cnn.com/2021/03/28/politics/infrastructure-plan-joe-biden/index.html","Analysis: Biden will have a tough time selling tax hikes for infrastructure"
"2021-03-28","202103281840","evening","https://us.cnn.com/videos/tv/2021/03/26/go-there-arwa-damon-iraq-war-anniversary-dpweekend.cnn","CNN producer: 18 years after war, this trauma is still inside me"
"2021-03-28","202103281840","evening","https://us.cnn.com/2021/03/28/us/derek-chauvin-george-floyd-trial-begin/index.html","Derek Chauvin is on trial for George Floyd's death. America's justice system is not"
"2021-03-28","202103281840","evening","https://us.cnn.com/2021/03/27/us/washington-dc-uber-eats-carjacking-homicide/index.html","Teen girls charged with murder and carjacking of Uber Eats driver in Washington"
"2021-03-28","202103281840","evening","https://us.cnn.com/videos/media/2021/03/28/press-media-criticism-biden-stelter-rs-vpx.cnn","Stelter: Are White House reporters out of sync with the country? "
"2021-03-28","202103281840","evening","https://us.cnn.com/2021/03/28/opinions/the-fried-egg-school-of-politics-opinion-weekly-column-galant/index.html","Opinion: Biden's Reagan moment"
"2021-03-28","202103282328","late","https://us.cnn.com/2021/03/28/health/us-coronavirus-sunday/index.html","The state has recorded 315 outbreaks linked to student sports teams or recreational clubs in the first two months of 2021, drawing a sharper focus on testing"
"2021-03-28","202103282328","late","https://us.cnn.com/2021/03/28/politics/birx-trump-covid-very-uncomfortable-phone-call/index.html","cnn exclusive Birx recalls 'very difficult' phone call from Trump following her Covid-19 warnings"
"2021-03-28","202103282328","late","https://us.cnn.com/videos/health/2021/03/27/birx-covid-war-coronavirus-deaths-reiner-nr-sot-vpx.cnn","'It makes me angry': Doctor says Dr. Birx failed to do her job"
"2021-03-28","202103282328","late","https://us.cnn.com/2021/03/27/politics/covid-war-deaths-preventable/index.html","Analysis: Birx says majority of Covid deaths were preventable"
"2021-03-28","202103282328","late","https://us.cnn.com/2021/03/28/politics/biden-administration-vaccination-passport/index.html","Biden administration working to develop a system for people to prove they've been vaccinated"
"2021-03-28","202103282328","late","https://us.cnn.com/videos/health/2021/03/28/deborah-birx-donald-trump-uncomfortable-conversation-gupta-covid-sotu-vpx.cnn","Birx describes 'uncomfortable conversation' with Trump after CNN interview "
"2021-03-28","202103282328","late","https://us.cnn.com/2021/03/28/health/children-unvaccinated-camp-playgrounds-summer/index.html","Conceivable that unvaccinated children could go to camp or playgrounds this summer, Fauci says"
"2021-03-28","202103282328","late","https://us.cnn.com/2021/03/28/opinions/hard-lesson-dr-deborah-birx-ranney/index.html","Opinion: The hard lesson of Dr. Deborah Birx"
"2021-03-28","202103282328","late","https://us.cnn.com/2021/03/28/politics/voting-rights-georgia-souls-polls-blake/index.html","Georgia Republicans made two big mistakes when they attacked voting rights "
"2021-03-28","202103282328","late","https://us.cnn.com/2021/03/28/africa/suez-canal-ship-blockage-intl/index.html","Despite progress, ship remains stuck in the Suez Canal"
"2021-03-28","202103282328","late","https://us.cnn.com/2021/03/28/politics/julia-letlow-covid-vaccine-republicans/index.html","Rep.-elect Letlow urges fellow Republicans to get Covid vaccine after husband's death"
"2021-03-28","202103282328","late","https://us.cnn.com/2021/03/28/us/virginia-beach-shootings-sunday/index.html","Deshayla Harris, 'Bad Girls Club' star, identified as a Virginia Beach shooting victim"
"2021-03-28","202103282328","late","https://us.cnn.com/2021/03/28/us/texas-teen-abducted-sex-offender/index.html","A teen girl abducted by a registered sex offender in Texas is in 'extreme danger,' sheriff's office says"
"2021-03-28","202103282328","late","https://us.cnn.com/videos/media/2021/03/28/dominion-defamation-case-against-fox-news-2020-election-stelter-rs-vpx.cnn","Stelter: Some Fox News victims are trying to tally up the damage that's been done"
"2021-03-28","202103282328","late","https://us.cnn.com/2021/03/28/africa/palma-mozambique-ambush-intl/index.html","Foreigners and locals among dozens killed in Mozambique terror attack"
"2021-03-28","202103282328","late","https://us.cnn.com/2021/03/28/weather/severe-weather-south-floods-sunday/index.html","Nashville declares emergency after deadly flash flooding"
"2021-03-28","202103282328","late","https://us.cnn.com/videos/tv/2021/03/28/lee-wong-scars-asian-american-veteran-ohio-orig-kj.cnn","Veteran reveals scars during meeting, asks 'Is this patriot enough?'"
"2021-03-28","202103282328","late","https://us.cnn.com/2021/03/28/us/maryland-cannonball-civil-war-detonate-trnd/index.html","Bomb squad detonates Civil War cannonball found in Maryland"
"2021-03-28","202103282328","late","https://us.cnn.com/videos/justice/2021/03/27/asian-american-support-rally-stop-hate-salon-letter-vercammen-nr-vpx.cnn","'This is not OK': Salon owner slams racist letter sent to businesses"
"2021-03-28","202103282328","late","https://us.cnn.com/2021/03/28/opinions/the-fried-egg-school-of-politics-opinion-weekly-column-galant/index.html","Opinion: Biden's Reagan moment"
"2021-03-29","202103290946","morning","https://us.cnn.com/2021/03/29/africa/suez-canal-refloating-intl-hnk/index.html","Massive container ship has been successfully refloated after being stranded in the Suez Canal for almost a week, authorities say"
"2021-03-29","202103290946","morning","https://us.cnn.com/travel/article/steering-worlds-biggest-ships-suez-canal-cmd/index.html","Interactive: What it's really like steering the world's biggest ships"
"2021-03-29","202103290946","morning","https://us.cnn.com/2021/03/26/world/gallery/suez-canal-stuck-ship/index.html","In pictures: Container ship stuck in Suez Canal"
"2021-03-29","202103290946","morning","https://us.cnn.com/videos/world/2021/03/27/suez-canal-ship-kids-solve-orig-jnd.cnn","We asked kids what they would do to free the ship in the Suez Canal"
"2021-03-29","202103290946","morning","https://us.cnn.com/2021/03/29/investing/global-stocks/index.html","Oil prices dip after ship is partially freed"
"2021-03-29","202103290946","morning","https://us.cnn.com/videos/business-videos/2021/03/25/suez-canal-ship-stuck-ever-given-blocking-orig-kj.cnn","Video shows effort to release ship stuck in Suez Canal"
"2021-03-29","202103290946","morning","https://us.cnn.com/2021/03/26/business/global-shipping-supply-chains/index.html","Global shipping was in chaos even before the Suez blockage. Shortages and higher prices loom"
"2021-03-29","202103290946","morning","https://us.cnn.com/2021/03/25/opinions/suez-canal-traffic-jam-jugular-mercogliano/index.html","Opinion: Suez Canal traffic jam blocks the world's jugular vein"
"2021-03-29","202103290946","morning","https://us.cnn.com/2021/03/29/politics/coronavirus-deborah-birx-donald-trump-joe-biden/index.html","America's pandemic dead deserve accountability after Birx disclosure"
"2021-03-29","202103290946","morning","https://us.cnn.com/2021/03/29/health/us-coronavirus-monday/index.html","This state says a Covid-19 surge is already here, and other states report concerning increases in cases"
"2021-03-29","202103290946","morning","https://us.cnn.com/2021/03/28/us/texas-teen-abducted-sex-offender/index.html","A teen girl abducted by a registered sex offender in Texas is in 'extreme danger,' sheriff's office says"
"2021-03-29","202103290946","morning","https://us.cnn.com/2021/03/29/business/petr-kellner-helicopter-crash/index.html","Czech billionaire Petr Kellner among five killed in helicopter crash in Alaska"
"2021-03-29","202103290946","morning","https://us.cnn.com/2021/03/29/asia/who-wuhan-report-preview-intl-hnk/index.html","Wildlife trade most likely pathway for coronavirus to arrive in Wuhan, WHO expert says"
"2021-03-29","202103290946","morning","https://us.cnn.com/2021/03/28/us/virginia-beach-shootings-sunday/index.html","Deshayla Harris, 'Bad Girls Club' star, identified as a Virginia Beach shooting victim"
"2021-03-29","202103290946","morning","https://us.cnn.com/videos/media/2021/03/28/dominion-defamation-case-against-fox-news-2020-election-stelter-rs-vpx.cnn","Stelter: Some Fox News victims are trying to tally up the damage that's been done"
"2021-03-29","202103290946","morning","https://us.cnn.com/videos/tv/2021/03/28/lee-wong-scars-asian-american-veteran-ohio-orig-kj.cnn","Veteran reveals scars during meeting, asks 'Is this patriot enough?'"
"2021-03-29","202103290946","morning","https://us.cnn.com/2021/03/28/opinions/the-fried-egg-school-of-politics-opinion-weekly-column-galant/index.html","Opinion: Biden's Reagan moment"
"2021-03-29","202103290946","morning","https://us.cnn.com/2021/03/29/asia/myanmar-deadly-weekend-intl-hnk/index.html","Anguish in Myanmar after weekend of 'outrageous' bloodshed"
"2021-03-29","202103290946","morning","https://us.cnn.com/videos/justice/2021/03/27/asian-american-support-rally-stop-hate-salon-letter-vercammen-nr-vpx.cnn","'This is not OK': Salon owner slams racist letter sent to local businesses"
"2021-03-29","202103290946","morning","https://us.cnn.com/2021/03/28/opinions/weiser-diamond-and-silk-vile-rhetoric-obeidallah/index.html","Opinion: There's no place in the US for this vile rhetoric"
"2021-03-29","202103291426","midday","https://www.cnn.com/africa/live-news/suez-canal-shipping-crisis-03-29-21/h_6d43349d407a2026a9dc95f25aee13de","The container ship that has been stuck in the Suez Canal for almost a week has been fully dislodged and is currently floating free"
"2021-03-29","202103291426","midday","https://us.cnn.com/2021/03/29/africa/suez-canal-refloating-intl-hnk/index.html","Ever Given ship freed in the Suez Canal, authority confirms"
"2021-03-29","202103291426","midday","https://us.cnn.com/2021/03/29/investing/premarket-stocks-trading/index.html","The Suez Canal fiasco could disrupt supplies for months to come"
"2021-03-29","202103291426","midday","https://us.cnn.com/travel/article/steering-worlds-biggest-ships-suez-canal-cmd/index.html","Interactive: What it's really like steering the world's biggest ships"
"2021-03-29","202103291426","midday","https://us.cnn.com/2021/03/26/world/gallery/suez-canal-stuck-ship/index.html","In pictures: Container ship stuck in Suez Canal"
"2021-03-29","202103291426","midday","https://us.cnn.com/2021/03/29/world/suez-canal-block-impact-intl/index.html","All hands on deck as Suez locals ply food and wares crews"
"2021-03-29","202103291426","midday","https://us.cnn.com/2021/03/26/business/global-shipping-supply-chains/index.html","Global shipping was in chaos even before the Suez blockage"
"2021-03-29","202103291426","midday","https://us.cnn.com/videos/world/2021/03/29/suez-canal-ever-given-ship-refloated-intl-hnk-vpx.cnn","Video shows stern of ship dislodged from Suez Canal bank "
"2021-03-29","202103291426","midday","https://us.cnn.com/2021/03/25/opinions/suez-canal-traffic-jam-jugular-mercogliano/index.html","Opinion: Suez Canal traffic jam blocks the world's jugular vein"
"2021-03-29","202103291426","midday","https://us.cnn.com/2021/03/29/politics/coronavirus-deborah-birx-donald-trump-joe-biden/index.html","America's pandemic dead deserve accountability after Birx disclosure"
"2021-03-29","202103291426","midday","https://us.cnn.com/2021/03/29/health/us-coronavirus-monday/index.html","This state says a Covid surge is already here"
"2021-03-29","202103291426","midday","https://www.cnn.com/2021/03/29/politics/kentucky-abortion-law-supreme-court/index.html","Breaking Supreme Court to hear whether Republican attorney general can defend Kentucky abortion law "
"2021-03-29","202103291426","midday","https://us.cnn.com/2021/03/29/business/petr-kellner-helicopter-crash/index.html","Czech billionaire Petr Kellner among five killed in helicopter crash in Alaska"
"2021-03-29","202103291426","midday","https://us.cnn.com/2021/03/29/business/reparations-hr-40-fed-bostic/index.html","CNN Exclusive There are 'definitely merits' to reparations, says the first Black Fed president"
"2021-03-29","202103291426","midday","https://us.cnn.com/2021/03/29/africa/barack-obama-grandmother-dies-kenya-intl/index.html","Barack Obama's step-grandmother and family matriarch 'Mama Sarah' dies in Kenya"
"2021-03-29","202103291426","midday","https://us.cnn.com/2021/03/29/politics/pentagon-contractors-afghanistan/index.html","Pentagon could open itself to costly litigation if US pulls out Afghanistan this year"
"2021-03-29","202103291426","midday","https://us.cnn.com/videos/media/2021/03/28/dominion-defamation-case-against-fox-news-2020-election-stelter-rs-vpx.cnn","Stelter: Some Fox News victims are trying to tally up the damage that's been done"
"2021-03-29","202103291426","midday","https://us.cnn.com/2021/03/29/europe/uyghur-istanbul-children-china-intl/index.html","These children escaped Xinjiang, but their parents are in China and cut off from the world "
"2021-03-29","202103291426","midday","https://us.cnn.com/videos/tv/2021/03/28/lee-wong-scars-asian-american-veteran-ohio-orig-kj.cnn","Veteran reveals scars during meeting, asks 'Is this patriot enough?'"
"2021-03-29","202103291426","midday","https://us.cnn.com/2021/03/29/asia/myanmar-deadly-weekend-intl-hnk/index.html","Anguish in Myanmar after weekend of 'outrageous' bloodshed"
"2021-03-29","202103291426","midday","https://us.cnn.com/videos/justice/2021/03/27/asian-american-support-rally-stop-hate-salon-letter-vercammen-nr-vpx.cnn","'This is not OK': Salon owner slams racist letter sent to local businesses"
"2021-03-29","202103291426","midday","https://us.cnn.com/2021/03/28/opinions/weiser-diamond-and-silk-vile-rhetoric-obeidallah/index.html","Opinion: There's no place in the US for this vile rhetoric"
"2021-03-29","202103291839","evening","https://www.cnn.com/world/live-news/coronavirus-pandemic-vaccine-updates-03-29-21/h_e873d4047e232eb7268b06e7fb6c5678","Dr. Rochelle Walensky said the US has come 'such a long way' with three vaccines and pleaded with the nation to keep following mitigation measures "
"2021-03-29","202103291839","evening","https://us.cnn.com/2021/03/29/politics/adults-vaccine-eligible-biden/index.html","BREAKING Biden to announce 90% of adults will be vaccine eligible in three weeks"
"2021-03-29","202103291839","evening","https://us.cnn.com/2021/03/29/health/us-coronavirus-monday/index.html","Some US states report disturbing case increases -- and one warns the surge is already here"
"2021-03-29","202103291839","evening","https://us.cnn.com/2021/03/29/success/cdc-eviction-order-extended/index.html","CDC extends eviction moratorium until June 30"
"2021-03-29","202103291839","evening","https://us.cnn.com/videos/business/2021/03/28/california-theme-parks-reopening-coronavirus-pandemic-vercammen-sot-nr-vpx.cnn","This California theme park is set to reopen, but there's a catch"
"2021-03-29","202103291839","evening","https://us.cnn.com/2021/03/29/opinions/texas-coffee-shop-maskless-customers-andrews/index.html","Opinion: I work at a Texas coffee shop. This is what it's been like trying to enforce our mask policy"
"2021-03-29","202103291839","evening","https://us.cnn.com/videos/world/2021/03/29/cuba-coronavirus-vaccines-oppmann-pkg-intl-ldn-vpx.cnn","This island could be on the cutting edge of vaccine research"
"2021-03-29","202103291839","evening","https://www.cnn.com/us/live-news/derek-chauvin-trial-opening-statements-03-29-2021/h_9fc49d966066a6c648fec3ffd3d7da60","Minneapolis 911 dispatcher testifies about sending police to the scene"
"2021-03-29","202103291839","evening","https://us.cnn.com/2021/03/29/politics/offshore-wind-energy-biden-announcement/index.html","White House announces offshore wind energy initiative creating jobs and addressing climate crisis"
"2021-03-29","202103291839","evening","https://www.cnn.com/africa/live-news/suez-canal-shipping-crisis-03-29-21/h_6d43349d407a2026a9dc95f25aee13de","Ship in Suez Canal is free, official says"
"2021-03-29","202103291839","evening","https://www.cnn.com/videos/world/2021/03/29/suez-canal-egypt-ever-given-container-ship-dislodged-floating-ctw-intl-ldn-vpx.cnn","See video of dislodged ship floating down Suez Canal"
"2021-03-29","202103291839","evening","https://us.cnn.com/2021/03/29/politics/lindsey-graham-ar-15-guns/index.html","Analysis: Why Lindsey Graham says he *has* to have an AR-15"
"2021-03-29","202103291839","evening","https://us.cnn.com/2021/03/29/politics/us-trade-suspension-myanmar/index.html","US suspends all trade with Myanmar after weekend of violence against protesters"
"2021-03-29","202103291839","evening","https://us.cnn.com/2021/03/29/politics/supreme-court-hillary-clinton-private-email-server/index.html","Hillary Clinton cannot be deposed in private email lawsuit, SCOTUS affirms"
"2021-03-29","202103291839","evening","https://us.cnn.com/videos/sports/2021/03/29/justin-herron-nfl-player-saves-woman-sexual-assault-intv-newday-vpx.cnn","New England Patriots player saves woman from sexual assault"
"2021-03-29","202103291839","evening","https://us.cnn.com/2021/03/29/politics/thom-tillis-prostate-cancer-surgery/index.html","North Carolina Republican Sen. Thom Tillis announces he has prostate cancer"
"2021-03-29","202103291839","evening","https://us.cnn.com/2021/03/29/africa/barack-obama-grandmother-dies-kenya-intl/index.html","Barack Obama's step-grandmother and family matriarch 'Mama Sarah' dies in Kenya"
"2021-03-29","202103291839","evening","https://us.cnn.com/videos/justice/2021/03/27/asian-american-support-rally-stop-hate-salon-letter-vercammen-nr-vpx.cnn","'This is not OK': Salon owner slams racist letter sent to local businesses"
"2021-03-29","202103292329","late","https://us.cnn.com/2021/03/29/us/georgia-voting-law-sports-events/index.html","The state has a long history of attracting national sports events, but a controversial new voting law might severely impact that tradition"
"2021-03-29","202103292329","late","https://us.cnn.com/2021/03/29/world/meanwhile-in-america-march-29-intl/index.html","Analysis: What to make of Georgia's new voting law"
"2021-03-29","202103292329","late","http://www.cnn.com/2021/03/28/politics/raphael-warnock-biden-voting-rights-infrastructure-cnntv/index.html","Warnock invokes Biblical story to describe GOP efforts"
"2021-03-29","202103292329","late","https://us.cnn.com/videos/politics/2021/03/28/gabriel-sterling-new-georgia-voting-law-election-intv-nr-vpx.cnn","Election official who called out Trump defends GA voting law"
"2021-03-29","202103292329","late","https://us.cnn.com/2021/03/28/politics/voting-rights-georgia-souls-polls-blake/index.html","Analysis: Georgia GOP made two big mistakes when they attacked voting rights "
"2021-03-29","202103292329","late","https://us.cnn.com/2021/03/29/politics/us-house-seat-iowa-briefs/index.html","Lawyer for House candidate pushes for panel to 'count every vote,' as Democrats grow skeptical of overturning election"
"2021-03-29","202103292329","late","https://us.cnn.com/2021/03/29/politics/georgia-second-lawsuit-voting-law/index.html","Groups file second lawsuit challenging new Georgia voting law"
"2021-03-29","202103292329","late","https://us.cnn.com/2021/03/29/politics/lindsey-graham-ar-15-guns/index.html","Lindsey Graham's reason for owning an AR-15 sounds like the plot from 'The Purge'"
"2021-03-29","202103292329","late","https://www.cnn.com/world/live-news/coronavirus-pandemic-vaccine-updates-03-29-21/h_f5cf09686fba45277ad88ed831c4dabc","Biden urges states: 'Reinstate the mask mandate. Please.'"
"2021-03-29","202103292329","late","https://us.cnn.com/2021/03/29/us/ghislaine-maxwell-sex-trafficking-charges/index.html","Federal prosecutors add sex trafficking charges against Ghislaine Maxwell"
"2021-03-29","202103292329","late","https://us.cnn.com/2021/03/29/us/george-floyd-timing-929-846/index.html","Ex-officer Chauvin knelt on George Floyd for 9 minutes and 29 seconds -- not 8:46"
"2021-03-29","202103292329","late","https://us.cnn.com/2021/03/29/business/volkswagen-voltswagen/index.html","Volkswagen America might change its name"
"2021-03-29","202103292329","late","https://www.cnn.com/africa/live-news/suez-canal-shipping-crisis-03-29-21","Ship in Suez Canal is free, official says"
"2021-03-29","202103292329","late","https://us.cnn.com/videos/world/2021/03/29/suez-canal-egypt-ever-given-container-ship-dislodged-floating-ctw-intl-ldn-vpx.cnn","See video of dislodged ship floating down Suez Canal"
"2021-03-29","202103292329","late","https://us.cnn.com/2021/03/29/us/nashville-flooding-monday/index.html","Nashville flash flood leaves six dead and dozens of homes and businesses destroyed"
"2021-03-29","202103292329","late","https://us.cnn.com/2021/03/29/politics/buttigieg-no-gas-tax-mileage-tax-biden-infrastructure-plan-cnntv/index.html","Buttigieg says no gas or mileage tax in Biden's infrastructure plan"
"2021-03-29","202103292329","late","https://us.cnn.com/videos/sports/2021/03/29/justin-herron-nfl-player-saves-woman-sexual-assault-intv-newday-vpx.cnn","New England Patriots player saves woman from sexual assault"
"2021-03-29","202103292329","late","https://us.cnn.com/2021/03/29/politics/thom-tillis-prostate-cancer-surgery/index.html","North Carolina Republican Sen. Thom Tillis announces he has prostate cancer"
"2021-03-29","202103292329","late","https://us.cnn.com/videos/tv/2021/03/26/amanpour-migrants-border-immigration-paola-ramos-latin-america.cnn","VICE reporter treks dangerous jungle with migrants. Here's what she saw"
