"date","timestamp","session","href","txt"
"2021-03-22","202115220515","midday","https://us.cnn.com/2021/03/22/politics/us-eu-china-uyghur-sanctions/index.html","Penalties come days after a heated clash between US Secretary of State Blinken and senior Chinese officials"
"2021-03-22","202115220515","midday","https://us.cnn.com/2021/03/18/china/xinjiang-uyghur-families-china-amnesty-report-exclusive-dst-intl-hnk/index.html","Beijing has separated thousands of children from their parents in Xinjiang, new report claims. CNN found two of them"
"2021-03-22","202115220515","midday","https://us.cnn.com/videos/world/2021/03/08/uyghur-china-genocide-claims-beijing-denial-xinjiang-intv-holmes-intl-ldn-vpx.cnn","Uyghur journalist reacts after Beijing dismisses genocide claims"
"2021-03-22","202115220515","midday","https://us.cnn.com/2021/03/09/asia/china-uyghurs-xinjiang-genocide-report-intl-hnk/index.html","CNN Exclusive New report claims evidence of Beijing's 'intent to destroy' Uyghur people"
"2021-03-22","202115220515","midday","https://us.cnn.com/videos/politics/2021/03/19/us-china-tense-meeting-alaska-bts-vpx.cnn","US-China meeting breaks into tense confrontation on camera"
"2021-03-22","202115220515","midday","https://us.cnn.com/2021/03/20/politics/biden-russia-china-tough-rhetoric-foreign-policy/index.html","Biden administration off to a combative start with tough rhetoric on Russia, China"
"2021-03-22","202115220515","midday","https://us.cnn.com/2021/03/21/asia/china-canada-michael-kovrig-trial-intl-hnk/index.html","Diplomats denied access as Canadian goes on trial in China"
"2021-03-22","202115220515","midday","https://us.cnn.com/2021/02/23/opinions/uyghurs-china-biden-atrocities-khan/index.html","Opinion: Targeting cotton and the Olympics should be Biden's first steps in handling China's Uyghur crimes"
"2021-03-22","202115220515","midday","https://www.cnn.com/world/live-news/coronavirus-pandemic-vaccine-updates-03-22-21/h_ad97eb5de26b14967b9ce69aa0f20c4e","Why April may be key for AstraZeneca's vaccine"
"2021-03-22","202115220515","midday","https://us.cnn.com/2021/03/22/politics/border-patrol-overcrowded-photos/index.html","Behind closed doors at a US Border Patrol facility in Texas"
"2021-03-22","202115220515","midday","https://us.cnn.com/2021/03/22/europe/belarus-abuse-claims-intl-cmd/index.html","They wanted democracy. Instead they were beaten and raped by police"
"2021-03-22","202115220515","midday","https://us.cnn.com/2021/03/22/politics/boston-marathon-supreme-court-death-penalty/index.html","Breaking SCOTUS agrees to review Boston Marathon bomber's death penalty case"
"2021-03-22","202115220515","midday","https://us.cnn.com/2021/03/22/sport/katherine-diaz-killed-surfing-spt-intl/index.html","Olympic surfing hopeful Katherine Diaz, 22, killed by lightning while training"
"2021-03-22","202115220515","midday","https://us.cnn.com/2021/03/21/politics/tom-reed-sexual-misconduct-allegation/index.html","Rep. Tom Reed takes 'full responsibility' after allegation of sexual misconduct"
"2021-03-22","202115220515","midday","https://us.cnn.com/videos/politics/2021/03/22/coronavirus-vaccine-focus-group-gop-voters-nr-vpx.cnn","See how vaccine hesitant GOP participants react to Covid-19 focus group"
"2021-03-22","202115220515","midday","https://us.cnn.com/2021/03/21/politics/andrew-cuomo-analysis/index.html","Analysis: 65% of Democrats wanted Eliot Spitzer to resign after his sex scandal, but only 23% want Cuomo out"
"2021-03-22","202115220515","midday","https://us.cnn.com/videos/us/2021/03/22/miami-beach-mayor-spring-break-crowd-curfew-newday-vpx.cnn","Miami Beach mayor's message to spring breakers: Don't come here"
"2021-03-22","202115220515","midday","https://us.cnn.com/2021/03/22/politics/mitch-mcconnell-filibuster-oped-kentucky-veto/index.html","McConnell describes legislative filibuster as 'Kentucky's veto'"
"2021-03-22","202115220515","midday","https://us.cnn.com/2021/03/21/media/donald-trump-social-media-network/index.html","Trump is returning to social media with his own platform, spokesman says"
"2021-03-22","202139220639","evening","https://us.cnn.com/2021/03/22/politics/us-eu-china-uyghur-sanctions/index.html","Penalties come days after a heated clash between US Secretary of State Blinken and senior Chinese officials"
"2021-03-22","202139220639","evening","https://us.cnn.com/2021/03/22/politics/us-allies-burma-sanctions/index.html","US and allies sanction Myanmar's military for violent repression of protesters"
"2021-03-22","202139220639","evening","https://us.cnn.com/2021/03/18/china/xinjiang-uyghur-families-china-amnesty-report-exclusive-dst-intl-hnk/index.html","Beijing has separated thousands of children from their parents in Xinjiang, new report claims. CNN found two of them"
"2021-03-22","202139220639","evening","https://us.cnn.com/videos/world/2021/03/08/uyghur-china-genocide-claims-beijing-denial-xinjiang-intv-holmes-intl-ldn-vpx.cnn","Uyghur journalist reacts after Beijing dismisses genocide claims"
"2021-03-22","202139220639","evening","https://us.cnn.com/2021/03/09/asia/china-uyghurs-xinjiang-genocide-report-intl-hnk/index.html","CNN Exclusive New report claims evidence of Beijing's 'intent to destroy' Uyghur people"
"2021-03-22","202139220639","evening","https://us.cnn.com/videos/politics/2021/03/19/us-china-tense-meeting-alaska-bts-vpx.cnn","US-China meeting breaks into tense confrontation on camera"
"2021-03-22","202139220639","evening","https://us.cnn.com/2021/03/21/asia/china-canada-michael-kovrig-trial-intl-hnk/index.html","Diplomats denied access as Canadian goes on trial in China"
"2021-03-22","202139220639","evening","https://us.cnn.com/2021/02/23/opinions/uyghurs-china-biden-atrocities-khan/index.html","Opinion: Targeting cotton and the Olympics should be Biden's first steps in handling China's Uyghur crimes"
"2021-03-22","202139220639","evening","https://www.cnn.com/world/live-news/coronavirus-pandemic-vaccine-updates-03-22-21/h_ad97eb5de26b14967b9ce69aa0f20c4e","Why April may be key for AstraZeneca's vaccine"
"2021-03-22","202139220639","evening","https://us.cnn.com/2021/03/22/politics/border-patrol-overcrowded-photos/index.html","Behind closed doors at a US Border Patrol facility in Texas"
"2021-03-22","202139220639","evening","https://us.cnn.com/2021/03/22/europe/belarus-abuse-claims-intl-cmd/index.html","They wanted democracy. Instead they were beaten and raped by police"
"2021-03-22","202139220639","evening","https://us.cnn.com/2021/03/22/sport/katherine-diaz-killed-surfing-spt-intl/index.html","Olympic surfing hopeful Katherine Diaz, 22, killed by lightning while training"
"2021-03-22","202139220639","evening","https://us.cnn.com/videos/politics/2021/03/22/coronavirus-vaccine-focus-group-gop-voters-nr-vpx.cnn","GOP voters asked to participate in Covid-19 focus group, here's what happened"
"2021-03-22","202139220639","evening","https://us.cnn.com/2021/03/22/success/existing-home-sales-feseries/index.html","Homes are selling at record speed as buyers scramble to find properties"
"2021-03-22","202139220639","evening","https://us.cnn.com/2021/03/21/politics/andrew-cuomo-analysis/index.html","Analysis: 65% of Democrats wanted Eliot Spitzer to resign after his sex scandal, but only 23% want Cuomo out"
"2021-03-22","202139220639","evening","https://us.cnn.com/videos/us/2021/03/22/miami-beach-mayor-spring-break-crowd-curfew-newday-vpx.cnn","Miami Beach imposes curfew to control unruly spring break crowd"
"2021-03-22","202139220639","evening","https://us.cnn.com/2021/03/22/politics/mitch-mcconnell-filibuster-oped-kentucky-veto/index.html","McConnell describes legislative filibuster as 'Kentucky's veto'"
"2021-03-22","202139220639","evening","https://us.cnn.com/2021/03/22/sport/nfl-colin-allred-insurrection-cmd-spt-intl/index.html","'I stood up and was prepared to fight': What this NFL linebacker was not expecting when he got to Congress"
"2021-03-22","202139220639","evening","https://us.cnn.com/2021/03/21/media/donald-trump-social-media-network/index.html","Trump is returning to social media with his own platform, spokesman says"
"2021-03-22","202103222327","late","https://us.cnn.com/2021/03/22/us/spa-shootings-officers-handcuffed-husband-of-victim-trnd/index.html","He and his wife were getting massages when the shooting started. He was detained for hours before being told she was dead."
"2021-03-22","202103222327","late","https://us.cnn.com/videos/us/2021/03/22/atlanta-spa-shooting-survivor-sot-keilar-nr-vpx.cnn","Survivor describes harrowing details of his masseuse being shot while he was getting massage"
"2021-03-22","202103222327","late","https://us.cnn.com/2021/03/22/us/afraid-cnn-special-report-asian-americans/index.html","Hate is haunting Asian Americans"
"2021-03-22","202103222327","late","https://us.cnn.com/2021/03/22/us/metro-atlanta-shootings-monday/index.html","Asian Americans demand change after shootings"
"2021-03-22","202103222327","late","https://us.cnn.com/2021/03/22/us/go-there-personal-essay-kyung-lah/index.html","My daughter's simple words remind me why Asian Americans should be proud"
"2021-03-22","202103222327","late","https://us.cnn.com/videos/business/2021/03/22/john-oliver-meghan-mccain-orig.cnn-business","John Oliver calls out Meghan McCain's response to shootings"
"2021-03-22","202103222327","late","https://www.cnn.com/us/live-news/colorado-king-soopers-shooting/h_2de4b011f614ee543939eeb00ac80710","Shirtless man taken by officers after  reports of shooter at Boulder supermarket"
"2021-03-22","202103222327","late","https://us.cnn.com/2021/03/22/media/fox-business-network-producer-eric-spinato-death/index.html","Top Fox producer dies from coronavirus"
"2021-03-22","202103222327","late","https://us.cnn.com/2021/03/22/politics/white-house-jobs-spending-trillions/index.html","White House aides prep $3 trillion jobs package for Biden"
"2021-03-22","202103222327","late","https://us.cnn.com/2021/03/22/politics/marty-walsh-confirmation-vote/index.html","Senate confirms Marty Walsh to be Labor secretary "
"2021-03-22","202103222327","late","https://us.cnn.com/videos/politics/2021/03/22/donald-trump-influence-republican-party-se-cupp-sot-vpx-nr.cnn","Trump brags about endorsement power during radio interview"
"2021-03-22","202103222327","late","https://us.cnn.com/2021/03/22/business/chip-shortage-pickups-suvs/index.html","Computer chip shortage starting to hit where it hurts"
"2021-03-22","202103222327","late","https://us.cnn.com/2021/03/22/politics/fact-check-jody-hice-car-dealerships-dc-statehood/index.html","Fact check: Arguing against statehood for DC, congressman says it has no car dealerships (it does)"
"2021-03-22","202103222327","late","https://us.cnn.com/videos/politics/2021/03/22/coronavirus-vaccine-focus-group-gop-voters-nr-vpx.cnn","GOP voters asked to participate in Covid-19 focus group, here's what happened"
"2021-03-22","202103222327","late","https://us.cnn.com/2021/03/22/politics/border-detention-photos/index.html","Analysis: We keep seeing the same scenes at the border. Here are two big reasons why"
"2021-03-22","202103222327","late","https://us.cnn.com/videos/us/2021/03/21/dallas-migrant-children-biden-immigration-saenz-rodriguez-sot-nr-vpx.cnn","Volunteer describes what it looks like inside intake site for migrant children"
"2021-03-23","202103230929","morning","https://us.cnn.com/2021/03/23/us/boulder-colorado-shooting-tuesday/index.html","Officer Eric Talley was one of the victims killed at the King Soopers shooting. A suspect is in custody."
"2021-03-23","202103230929","morning","https://www.cnn.com/us/live-news/colorado-king-soopers-shooting/h_16ea3dc5703c2f9463cf7a7b5046c9ff","Colorado incident is seventh mass shooting in US in past 7 days"
"2021-03-23","202103230929","morning","https://us.cnn.com/videos/us/2021/03/23/boulder-supermarket-shooting-police-chief-presser-sot-vpx.cnn","Police chief gets emotional describing slain officer's response"
"2021-03-23","202103230929","morning","https://us.cnn.com/2021/03/23/us/boulder-colorado-shootings-what-we-know/index.html","Here is what we know about the mass shooting in Boulder, Colorado, that left 10 dead"
"2021-03-23","202103230929","morning","https://www.cnn.com/us/live-news/colorado-king-soopers-shooting/h_d97fb015748f2d53174cc11698a12cfb","Colorado governor says 'today we saw the face of evil'"
"2021-03-23","202103230929","morning","https://us.cnn.com/2021/03/22/us/gallery/colorado-grocery-store-shooting/index.html","In pictures: Grocery store shooting in Colorado"
"2021-03-23","202103230929","morning","https://us.cnn.com/videos/us/2021/03/22/video-boulder-colorado-king-soopers-inside-store-ebof-vpx.cnn","People seen lying on the ground in eyewitness video of Colorado shooting"
"2021-03-23","202103230929","morning","https://us.cnn.com/2021/03/23/us/shooting-survivors-group/index.html","These survivors stand ready to help the victims' families"
"2021-03-23","202103230929","morning","https://www.cnn.com/us/live-news/colorado-king-soopers-shooting/h_a0cf6d87165b29b50db2be4f486f5af0","District attorney calls shooting a 'tragedy and nightmare'"
"2021-03-23","202103230929","morning","https://www.cnn.com/world/live-news/coronavirus-pandemic-vaccine-updates-03-23-21/index.html","Independent US board 'concerned' by AstraZeneca's vaccine data announcements"
"2021-03-23","202103230929","morning","https://us.cnn.com/2021/03/23/politics/trump-mo-brooks-election-lie/index.html","Trump's army takes aim at 2022 touting his election lies"
"2021-03-23","202103230929","morning","https://us.cnn.com/2021/03/23/us/spring-valley-new-york-senior-center-fire/index.html","One firefighter and some residents are unaccounted for in fire at New York senior center"
"2021-03-23","202103230929","morning","https://us.cnn.com/2021/03/22/politics/sidney-powell-dominion-lawsuit-election-fraud/index.html","Sidney Powell argues in new court filing that no reasonable people would believe her election fraud claims"
"2021-03-23","202103230929","morning","https://us.cnn.com/2021/03/23/politics/voting-rights-republicans-bills-demographics/index.html","Analysis: Why Republican voter restrictions are a race against time"
"2021-03-23","202103230929","morning","https://us.cnn.com/2021/03/22/health/fully-vaccinated-coronavirus-cdc-advice-wellness/index.html","Fully vaccinated people can visit unvaccinated family and friends, but one household at a time, CDC official says "
"2021-03-23","202103230929","morning","https://us.cnn.com/videos/business/2021/03/23/texas-mask-mandate-restaurant-business-owners-lavandera-pkg-ac360-vpx.cnn","Here's how businesses are handling Texas lifting its mask mandate"
"2021-03-23","202103230929","morning","https://us.cnn.com/videos/politics/2021/03/22/coronavirus-vaccine-focus-group-gop-voters-nr-vpx.cnn","GOP voters asked to participate in Covid-19 focus group, here's what happened"
"2021-03-23","202103230929","morning","https://us.cnn.com/2021/03/22/politics/biden-health-care-trump-affordable-care-act/index.html","Biden's moves on Obamacare attract new signups -- and a second look from red states"
"2021-03-23","202103230929","morning","https://us.cnn.com/2021/03/22/politics/white-house-jobs-spending-trillions/index.html","White House aides prep $3 trillion jobs package for Biden"
"2021-03-23","202103230929","morning","https://us.cnn.com/videos/us/2021/03/23/air-force-drone-found-florida-beach-pkg-vpx.wplg","Air Force drone found on Florida beach "
"2021-03-23","202103231427","midday","https://us.cnn.com/2021/03/23/health/astrazeneca-vaccine-dsmb-statement/index.html","Trial review board raises concerns about AstraZeneca vaccine data"
"2021-03-23","202103231427","midday","https://us.cnn.com/2021/03/23/politics/trump-mo-brooks-election-lie/index.html","Trump's army takes aim at 2022 touting his election lies"
"2021-03-23","202103231427","midday","https://www.cnn.com/us/live-news/boulder-colorado-shooting-3-23-21/h_0d66cf883987db43d439ccd4c0e52a45","Authorities are about to give an update on the Colorado mass shooting that left 10 people dead"
"2021-03-23","202103231427","midday","https://us.cnn.com/2021/03/23/us/boulder-colorado-shooting-tuesday/index.html","Suspect in custody after gunfire erupts at grocery store"
"2021-03-23","202103231427","midday","https://us.cnn.com/2021/03/23/us/7-mass-shootings-7-days-trnd/index.html","Incident is seventh mass shooting in US in past 7 days"
"2021-03-23","202103231427","midday","https://us.cnn.com/videos/us/2021/03/23/andrew-mccabe-boulder-colorado-shooting-newday-vpx.cnn","McCabe: 'Absolutely nothing' will keep this from happening again"
"2021-03-23","202103231427","midday","https://us.cnn.com/2021/03/23/us/boulder-officer-killed-talley-profile/index.html","Slain officer sought safer job, leaves behind 7 children"
"2021-03-23","202103231427","midday","https://us.cnn.com/2021/03/23/politics/biden-gun-control-colorado-atlanta/index.html","Pressure builds on Biden to act on guns in wake of shooting"
"2021-03-23","202103231427","midday","https://us.cnn.com/2021/03/22/us/boulder-colorado-shooting-witness-accounts/index.html","'Gun, gun, gun! Run, run, run!' Witnesses describe deadly rampage"
"2021-03-23","202103231427","midday","https://us.cnn.com/videos/us/2021/03/22/video-boulder-colorado-king-soopers-inside-store-ebof-vpx.cnn","Eyewitness video shows people lying on the ground during active shooter situation"
"2021-03-23","202103231427","midday","https://us.cnn.com/2021/03/23/us/shooting-survivors-group/index.html","These survivors stand ready to help the victims' families"
"2021-03-23","202103231427","midday","http://www.cnn.com/2021/03/22/politics/sidney-powell-dominion-lawsuit-election-fraud/index.html","Sidney Powell argues in new court filing that no reasonable people would believe her election fraud claims"
"2021-03-23","202103231427","midday","https://us.cnn.com/2021/03/23/politics/louis-dejoy-postal-service-changes-ten-year-plan/index.html","New 10-year plan will include longer mail delivery times and cuts to post office hours"
"2021-03-23","202103231427","midday","https://us.cnn.com/2021/03/22/opinions/donald-trump-net-worth-dantonio/index.html","Opinion: Trump's presidency was a disaster for his business "
"2021-03-23","202103231427","midday","https://us.cnn.com/videos/business/2021/03/22/john-oliver-meghan-mccain-orig.cnn-business","John Oliver calls out Meghan McCain's response to Atlanta shootings"
"2021-03-23","202103231427","midday","https://us.cnn.com/2021/03/22/us/reparations-evanston-hr-40-legislation-whats-next/index.html","Chicago suburb first in US to pay reparations for Black residents "
"2021-03-23","202103231427","midday","https://us.cnn.com/2021/03/23/us/spring-valley-new-york-senior-center-fire/index.html","1 resident dead, firefighter missing after NY senior center fire"
"2021-03-23","202103231427","midday","https://us.cnn.com/2021/03/16/politics/voting-rights-debates-by-state/index.html","Analysis: At least 45 states have seen bills aimed at voter suppression. Here's why"
"2021-03-23","202103231427","midday","https://us.cnn.com/2021/03/23/politics/voting-rights-republicans-bills-demographics/index.html","Analysis: Why Republican voter restrictions are a race against time"
"2021-03-23","202103231427","midday","https://www.cnn.com/world/live-news/coronavirus-pandemic-vaccine-updates-03-23-21/h_015eae08bf94e38bc284567325a5b2a1","LIVE UPDATES New study probes Covid-19 long-haulers"
"2021-03-23","202103231427","midday","https://us.cnn.com/videos/politics/2021/03/22/coronavirus-vaccine-focus-group-gop-voters-nr-vpx.cnn","GOP voters asked to participate in Covid-19 focus group, here's what happened"
"2021-03-23","202103231427","midday","https://us.cnn.com/2021/03/23/africa/ethiopia-rape-abuse-abiy-response-intl/index.html","Ethiopian leader says troops who raped civilians will be held accountable after CNN investigation"
"2021-03-23","202103231427","midday","https://us.cnn.com/videos/us/2021/03/23/air-force-drone-found-florida-beach-pkg-vpx.wplg","Air Force drone found on Florida beach "
"2021-03-23","202103231831","evening","https://us.cnn.com/2021/03/23/us/victims-of-boulder-shooting/index.html","A young store manager and a father of 7 were among the Boulder shooting victims"
"2021-03-23","202103231831","evening","https://us.cnn.com/2021/03/22/politics/sidney-powell-dominion-lawsuit-election-fraud/index.html","Ex-Trump lawyer: Reasonable people wouldn't believe my election fraud claims"
"2021-03-23","202103231831","evening","http://www.cnn.com/us/live-news/boulder-colorado-shooting-3-23-21/index.html","Biden says officer killed in the Boulder shooting was the definition of an American hero and urged Congress to act quickly on gun reform"
"2021-03-23","202103231831","evening","https://us.cnn.com/videos/politics/2021/03/23/joe-biden-colorado-supermarket-shooting-sot-vpx.cnn","Watch Biden's remarks on Colorado mass shooting"
"2021-03-23","202103231831","evening","https://us.cnn.com/2021/03/23/us/boulder-colorado-shooting-tuesday/index.html","Motive still unclear in grocery massacre that killed 10, authorities say"
"2021-03-23","202103231831","evening","https://www.cnn.com/us/live-news/boulder-colorado-shooting-3-23-21/h_5e910dd4878b22255778512b34d3bf7d","Senate hearing on gun reform measures grows tense"
"2021-03-23","202103231831","evening","https://us.cnn.com/2021/03/23/us/boulder-colorado-shooting-suspect/index.html","What we know about the shooting suspect"
"2021-03-23","202103231831","evening","https://www.cnn.com/us/live-news/boulder-colorado-shooting-3-23-21/h_0c662370eefaeff05eac3ef8d5f29e94","Search of suspect's home turned up weapons, source says"
"2021-03-23","202103231831","evening","https://us.cnn.com/videos/us/2021/03/22/video-boulder-colorado-king-soopers-inside-store-ebof-vpx.cnn","Eyewitness video shows people lying on the ground during active shooter situation"
"2021-03-23","202103231831","evening","https://us.cnn.com/2021/03/23/politics/obama-boulder-colorado-shooting/index.html","Obama bemoans tolerance for 'random, senseless acts' of gun violence"
"2021-03-23","202103231831","evening","https://us.cnn.com/2021/03/23/opinions/colorado-killings-gun-control-filibuster-opinion-murray/index.html","Opinion: What has to happen after the Colorado killings"
"2021-03-23","202103231831","evening","http://www.cnn.com/2021/03/23/politics/louis-dejoy-postal-service-changes-ten-year-plan/index.html","New USPS plan will include longer mail delivery times and cuts to post office hours"
"2021-03-23","202103231831","evening","https://us.cnn.com/2021/03/23/politics/capitol-nazi-sympathizer-hale-cusanelli/index.html","Judge orders Capitol rioter and Nazi sympathizer to remain in jail ahead of trial"
"2021-03-23","202103231831","evening","https://us.cnn.com/2021/03/10/us/derek-chauvin-trial-jurors/index.html","Jury seated in trial of ex-cop accused in death of George Floyd"
"2021-03-23","202103231831","evening","https://us.cnn.com/2021/03/23/tech/prince-harry-betterup-tech-startup/index.html","Prince Harry lands a new job"
"2021-03-23","202103231831","evening","https://us.cnn.com/2021/03/22/opinions/donald-trump-net-worth-dantonio/index.html","Opinion: Trump's presidency was a disaster for his business "
"2021-03-23","202103231831","evening","https://us.cnn.com/2021/03/23/politics/stimulus-check-two-payments-married-couples/index.html","Why some couples are getting their stimulus money in two payments"
"2021-03-23","202103231831","evening","https://us.cnn.com/videos/us/2021/03/23/air-force-drone-found-florida-beach-pkg-vpx.wplg","Huge Air Force drone washes ashore on beach "
"2021-03-23","202103231831","evening","https://www.cnn.com/world/live-news/coronavirus-pandemic-vaccine-updates-03-23-21/h_b558295c0350be2fa3b3af5c7ab52c8e","LIVE UPDATES Texas to extend vaccine eligibility to all adults next week"
"2021-03-23","202103231831","evening","https://us.cnn.com/2021/03/23/health/us-coronavirus-tuesday/index.html","High levels of Covid infection right now could mean problems for vaccines later on"
"2021-03-23","202103231831","evening","https://us.cnn.com/videos/business/2021/03/22/john-oliver-meghan-mccain-orig.cnn-business","John Oliver calls out Meghan McCain's response to Atlanta shootings"
"2021-03-23","202103231831","evening","https://us.cnn.com/2021/03/23/politics/voting-rights-republicans-bills-demographics/index.html","Analysis: A young, non-White demography looms and Republicans are freaking out"
"2021-03-23","202103231831","evening","https://us.cnn.com/2021/03/23/opinions/president-biden-botching-border-crisis-jennings/index.html","Opinion: Biden is botching his first crisis"
"2021-03-23","202103231831","evening","https://us.cnn.com/2021/03/23/middleeast/israel-fourth-election-intl/index.html","Weary Israelis head to polls for fourth election in two years"
"2021-03-23","202103231831","evening","https://us.cnn.com/videos/politics/2021/03/22/coronavirus-vaccine-focus-group-gop-voters-nr-vpx.cnn","GOP voters asked to participate in Covid-19 focus group, here's what happened"
"2021-03-23","202103232329","late","https://www.cnn.com/2021/03/23/politics/scotus-second-amendment-new-york-boulder-colorado/index.html","Supreme Court to discuss case that could expand 2nd Amendment rights"
"2021-03-23","202103232329","late","https://us.cnn.com/2021/03/22/politics/sidney-powell-dominion-lawsuit-election-fraud/index.html","Ex-Trump lawyer: Reasonable people wouldn't believe my election fraud claims"
"2021-03-23","202103232329","late","https://us.cnn.com/2021/03/23/us/victims-of-boulder-shooting/index.html","10 victims were inexplicably gunned down at the grocery store in Boulder, Colorado"
"2021-03-23","202103232329","late","https://us.cnn.com/2021/03/23/us/boulder-officer-killed-talley-profile/index.html","The police officer killed in the shooting sought a safer job"
"2021-03-23","202103232329","late","https://us.cnn.com/2021/03/23/us/boulder-colorado-shooting-suspect/index.html","Here's what we know about the mass shooting suspect"
