"date","timestamp","session","href","txt"
"2021-03-25","202103251425","midday","https://www.cnn.com/2021/03/24/us/atlanta-man-with-guns-supermarket-publix/index.html","Atlanta police detain man with guns, body armor in grocery store"
"2021-03-25","202103251425","midday","https://us.cnn.com/2021/03/25/politics/drug-enforcement-agent-capitol-riot-investigation/index.html","DEA agent says he was wrongly fired for being at Capitol riot"
"2021-03-25","202103251425","midday","https://us.cnn.com/2021/03/25/weather/tornadoes-flood-watches-storms-south-thursday/index.html","Meteorologists expect a tornado outbreak across the South. Here's where"
"2021-03-25","202103251425","midday","https://www.cnn.com/interactive/storm-tracker/","INTERACTIVE Follow the severe storms"
"2021-03-25","202103251425","midday","https://us.cnn.com/2021/03/25/perspectives/small-business-ppp-eligibility/index.html","Opinion: I sold my wedding ring to keep my business alive"
"2021-03-25","202103251425","midday","https://us.cnn.com/videos/politics/2021/03/25/lindsey-graham-trump-rhetoric-dons-take-ctn-sot-vpx.cnn","See Lindsey Graham downplay Trump's dangerous rhetoric"
"2021-03-25","202103251425","midday","https://us.cnn.com/2021/03/24/business/covid-vaccine-incentives-companies/index.html","You could get incentives if you're vaccinated and work for one of these companies"
"2021-03-25","202103251425","midday","https://us.cnn.com/2021/03/25/us/oklahoma-osage-nation-covid-vaccines/index.html","This tribe couldn't find enough Native Americans to vaccinate, so it opened its services to anyone"
"2021-03-25","202103251425","midday","https://us.cnn.com/videos/politics/2021/03/24/video-new-york-times-capitol-riot-sicknick-lead-vpx.cnn","New video appears to show attack on slain officer during Capitol riot"
"2021-03-25","202103251425","midday","https://us.cnn.com/2021/03/24/opinions/donald-trump-social-media-twitter-zelizer/index.html","Opinion: Trump thirsts to be heard"
"2021-03-25","202103251841","evening","https://us.cnn.com/politics/live-news/joe-biden-news-conference-03-25-21/index.html","The President faced intense questions on the border crisis and other pressing issues"
"2021-03-25","202103251841","evening","http://cnn.it/go2","Watch live Analysis of Biden's first press conference"
"2021-03-25","202103251841","evening","https://www.cnn.com/politics/live-news/joe-biden-news-conference-03-25-21/h_1cb0aa4a6e240a53709ec5d04cddd990","Biden says he plans to run for re-election in 2024"
"2021-03-25","202103251841","evening","https://us.cnn.com/2021/03/25/politics/first-biden-press-conference/index.html","Biden faces wide-ranging questions on pressing issues"
"2021-03-25","202103251841","evening","https://us.cnn.com/videos/politics/2021/03/25/joe-biden-migrant-surge-at-border-sot-vpx.cnn","'It's not because I'm a nice guy': Biden on migrant surge"
"2021-03-25","202103251841","evening","https://us.cnn.com/2021/03/25/politics/biden-says-access-will-be-provided-to-border-facilities-but-doesnt-give-timeline/index.html","Biden says access will be provided to border facilities, but doesn't give timeline"
"2021-03-25","202103251841","evening","https://us.cnn.com/videos/politics/2021/01/19/joe-biden-on-covid-19-mh-orig.cnn","What Biden said he would do for the Covid-19 economy"
"2021-03-25","202103251841","evening","https://us.cnn.com/2021/03/20/politics/what-is-a-filibuster/index.html","Analysis: What's a filibuster? Democrats may finally ax this relic"
"2021-03-25","202103251841","evening","https://us.cnn.com/2021/03/25/tech/tech-ceos-hearing/index.html","Congress slams tech CEOs over handling of online extremism, misinformation"
"2021-03-25","202103251841","evening","https://us.cnn.com/2021/03/25/us/boulder-colorado-shooting-thursday/index.html","Boulder shooting suspect to remain in jail without bond"
"2021-03-25","202103251841","evening","http://www.cnn.com/2021/03/25/politics/georgia-state-house-voting-bill-passage/index.html","BREAKING Georgia House passes sweeping bill that would restrict voting access"
"2021-03-25","202103251841","evening","https://us.cnn.com/2021/03/25/politics/wyoming-bill-donald-trump-jr-liz-cheney/index.html","Wyoming Senate kills bill backed by Donald Trump Jr. in attempt to defeat Liz Cheney "
"2021-03-25","202103251841","evening","http://www.cnn.com/2021/03/25/weather/tornadoes-flood-watches-storms-south-thursday/index.html","Breaking Large tornado reported in Alabama as South braces for more"
"2021-03-25","202103251841","evening","https://www.cnn.com/us/live-news/tornadoes-storms-south-03-25-21/h_c0f4db5d7830a0fd3ba8ba94eb0aabc4","LIVE UPDATES Today's tornadoes could move as fast as 51 mph"
"2021-03-25","202103251841","evening","https://www.cnn.com/interactive/storm-tracker/","INTERACTIVE Follow the severe storms"
"2021-03-25","202103251841","evening","https://www.cnn.com/2021/03/25/us/nfl-player-saves-woman-sexual-assault-trnd/index.html","NFL player hailed for saving retired schoolteacher from a sexual assault"
"2021-03-25","202103251841","evening","https://us.cnn.com/videos/media/2021/03/25/ted-cruz-reporter-mask-vaccinations-sanjay-gupta-newday-sot-vpx.cnn","Ted Cruz refused request to wear a mask. Hear Gupta's response"
"2021-03-25","202103251841","evening","https://us.cnn.com/2021/03/25/politics/paycheck-protection-program-extension-senate-vote/index.html","Senate votes to extend PPP aid for small businesses"
"2021-03-25","202103251841","evening","https://us.cnn.com/2021/03/25/politics/drug-enforcement-agent-capitol-riot-investigation/index.html","DEA agent says he was wrongly fired for being at Capitol riot"
"2021-03-25","202103251841","evening","https://us.cnn.com/2021/03/25/us/chicago-trump-tower-vaccines-loretto-hospital/index.html","Hospital official resigns after vaccines were improperly distributed at Trump Tower in Chicago"
"2021-03-25","202103251841","evening","https://us.cnn.com/videos/politics/2021/03/25/lindsey-graham-trump-rhetoric-dons-take-ctn-sot-vpx.cnn","See Lindsey Graham downplay Trump's dangerous rhetoric"
"2021-03-25","202103251841","evening","https://us.cnn.com/2021/03/25/us/colorado-firearms-mental-health-trnd/index.html","These states don't prohibit someone with a mental illness from owning firearms"
"2021-03-25","202103252327","late","https://us.cnn.com/2021/03/25/politics/georgia-state-house-voting-bill-passage/index.html","In the span of a few hours, state Republicans pushed a sweeping bill into law, imposing new restrictions on voters in the battleground state"
"2021-03-25","202103252327","late","https://www.cnn.com/politics/live-news/georgia-voting-restrictions-bill-03-25-21/h_9f5126cdad9fa6d650580543b78c9914","live updates What voting rights groups have said about Georgia's elections bill"
"2021-03-25","202103252327","late","https://us.cnn.com/2021/03/16/politics/voting-rights-debates-by-state/index.html","Analysis: At least 45 states have seen bills aimed at voter suppression"
"2021-03-25","202103252327","late","https://us.cnn.com/videos/politics/2021/03/25/joe-biden-gop-voting-rights-laws-unamerican-and-sick-sot-vpx.cnn","'Un-American, sick': Biden slams state GOP's voting rights laws"
"2021-03-25","202103252327","late","https://us.cnn.com/2021/03/25/opinions/voting-rights-suppression-is-jim-crow-suit-and-tie-hemmer/index.html","Opinion: What Jim Crow looks like in 2021"
"2021-03-25","202103252327","late","https://us.cnn.com/2021/03/11/politics/arizona-republicans-voter-suppression-bills/index.html","Arizona Republican lawmakers join GOP efforts to target voting"
"2021-03-25","202103252327","late","https://us.cnn.com/2021/03/23/politics/voting-rights-republicans-bills-demographics/index.html","Analysis: Why GOP voter restrictions are a race against time"
"2021-03-25","202103252327","late","https://us.cnn.com/videos/politics/2021/03/24/chuck-schumer-mitch-mcconnell-voting-rights-bill-sot-vpx-lead.cnn","'Shame, shame, shame': Schumer calls out Republicans over election reform"
"2021-03-25","202103252327","late","https://us.cnn.com/2021/03/25/weather/tornadoes-flood-watches-storms-south-thursday/index.html","At least 5 deaths reported in Alabama after tornado touches down"
"2021-03-25","202103252327","late","https://www.cnn.com/2021/03/25/politics/joe-biden-news-conference-takeaways/index.html","Key takeaways from Biden's first formal news conference"
"2021-03-25","202103252327","late","https://us.cnn.com/2021/03/25/entertainment/jessica-walter-obit/index.html","'Arrested Development' star Jessica Walter dies"
"2021-03-25","202103252327","late","https://us.cnn.com/2021/03/25/tech/jack-dorsey-clock-blockchain/index.html","Here's the deal with Twitter CEO's weird 'clock' "
"2021-03-25","202103252327","late","https://us.cnn.com/2021/03/25/tech/tech-ceos-hearing/index.html","Congress slams tech CEOs over handling of online extremism, misinformation"
"2021-03-25","202103252327","late","https://us.cnn.com/2021/03/25/politics/wyoming-bill-donald-trump-jr-liz-cheney/index.html","Wyoming Senate kills bill backed by Donald Trump Jr. in attempt to defeat Liz Cheney "
"2021-03-25","202103252327","late","https://us.cnn.com/videos/media/2021/03/25/ted-cruz-reporter-mask-vaccinations-sanjay-gupta-newday-sot-vpx.cnn","Ted Cruz refused request to wear a mask. Hear Gupta's response"
"2021-03-25","202103252327","late","https://www.cnn.com/2021/03/25/us/nfl-player-saves-woman-sexual-assault-trnd/index.html","NFL player hailed for saving retired schoolteacher from a sexual assault"
"2021-03-25","202103252327","late","https://us.cnn.com/2021/03/25/us/massachusetts-anti-semitic-football-plays-trnd/index.html","Massachusetts high school removed football coach after the team used anti-Semitic language to call plays "
"2021-03-25","202103252327","late","https://us.cnn.com/videos/us/2021/03/25/robert-e-lee-high-school-renaming-jacksonville-florida-orig-jk.cnn","Hear residents' shocking defense of Robert E. Lee's name on their high school"
"2021-03-25","202103252327","late","https://us.cnn.com/2021/03/25/us/chicago-trump-tower-vaccines-loretto-hospital/index.html","Hospital official resigns after vaccines were improperly distributed at Trump Tower in Chicago"
"2021-03-25","202103252327","late","https://us.cnn.com/2021/03/25/middleeast/suez-canal-ship-blockage-intl-hnk/index.html","Dislodging the huge ship blocking the Suez Canal could take 'days to weeks'"
"2021-03-25","202103252327","late","https://us.cnn.com/videos/business-videos/2021/03/25/suez-canal-ship-stuck-ever-given-blocking-orig-kj.cnn","Video shows effort to release container vessel stuck in Suez Canal"
"2021-03-25","202103252327","late","https://us.cnn.com/2021/03/25/us/los-angeles-police-echo-park-homeless/index.html","LAPD shuts down homeless encampment"
"2021-03-25","202103252327","late","https://us.cnn.com/2021/03/25/politics/drug-enforcement-agent-capitol-riot-investigation/index.html","DEA agent says he was wrongly fired for being at Capitol riot"
"2021-03-26","202103260934","morning","https://us.cnn.com/2021/03/26/politics/georgia-voter-suppression-law-trump-biden/index.html","The former President's campaign of lies about a stolen election just delivered a huge victory"
"2021-03-26","202103260934","morning","https://us.cnn.com/2021/03/25/politics/georgia-state-house-voting-bill-passage/index.html","Georgia Republicans speed sweeping elections bill restricting voting access into law"
"2021-03-26","202103260934","morning","https://us.cnn.com/2021/03/25/politics/georgia-state-representative-arrested-governor-office/index.html","Georgia state lawmaker arrested protesting voting restriction bill outside governor's office"
"2021-03-26","202103260934","morning","https://us.cnn.com/videos/politics/2021/03/25/martin-luther-king-iii-georgia-voting-bill-sot-vpx-tsr.cnn","Hear Martin Luther King III's sharp words over Georgia bill"
"2021-03-26","202103260934","morning","https://us.cnn.com/2021/03/25/opinions/voting-rights-suppression-is-jim-crow-suit-and-tie-hemmer/index.html","Opinion: What Jim Crow looks like in 2021"
"2021-03-26","202103260934","morning","https://us.cnn.com/videos/politics/2021/03/24/chuck-schumer-mitch-mcconnell-voting-rights-bill-sot-vpx-lead.cnn","Schumer and McConnell clash over voting rights bill"
"2021-03-26","202103260934","morning","https://us.cnn.com/videos/us/2021/03/25/pelham-alabama-storm-video-sot-vpx.cnn","See stunning video from inside Alabama tornado"
"2021-03-26","202103260934","morning","https://us.cnn.com/2021/03/25/politics/fact-check-biden-first-press-conference/index.html"," Fact-checking Biden's first news conference as president "
"2021-03-26","202103260934","morning","https://us.cnn.com/2021/03/25/business/covid-loan-fraud-criminal-charges-james-polzin/index.html","CNN Investigates Fake CPA hit with criminal charges for Covid-19 loan fraud "
"2021-03-26","202103260934","morning","https://us.cnn.com/2021/03/25/us/duke-university-george-floyd-flier-trnd/index.html","A printout of George Floyd's toxicology report was found on a Black History display at Duke University, insinuating that he deserved to die"
"2021-03-26","202103260934","morning","https://us.cnn.com/videos/us/2021/03/25/robert-e-lee-high-school-renaming-jacksonville-florida-orig-jk.cnn","Hear residents' shocking defense of Robert E. Lee's name on their high school"
"2021-03-26","202103260934","morning","https://us.cnn.com/2021/03/25/us/keystone-pipeline-south-dakota-impact/index.html","What happened to two small South Dakota towns after Biden revoked the Keystone pipeline permit"
"2021-03-26","202103260934","morning","https://us.cnn.com/2021/03/25/middleeast/suez-canal-ship-sand-intl-hnk/index.html","Suez Canal authorities need to remove up to 706,000 cubic feet of sand to free ship"
"2021-03-26","202103260934","morning","https://www.cnn.com/2021/03/25/us/nfl-player-saves-woman-sexual-assault-trnd/index.html","NFL player hailed for saving retired schoolteacher from a sexual assault"
"2021-03-26","202103260934","morning","https://us.cnn.com/2021/03/25/politics/wyoming-bill-donald-trump-jr-liz-cheney/index.html","Wyoming Senate kills bill backed by Donald Trump Jr. in attempt to defeat Liz Cheney "
"2021-03-26","202103260934","morning","https://us.cnn.com/videos/media/2021/03/25/ted-cruz-reporter-mask-vaccinations-sanjay-gupta-newday-sot-vpx.cnn","Ted Cruz refused request to wear a mask. Hear Gupta's response"
"2021-03-26","202103260934","morning","https://us.cnn.com/2021/03/25/politics/migrants-us-mexico-border-expelled-health-order/index.html","More than half of all migrants at border expelled under health order in recent weeks "
"2021-03-26","202103260934","morning","https://us.cnn.com/2021/03/25/asia/myanmar-family-hiding-khin-myo-chit-intl-hnk/index.html","Grieving family of young girl shot dead by Myanmar's military forced into hiding"
"2021-03-26","202103260934","morning","https://us.cnn.com/videos/business-videos/2021/03/25/suez-canal-ship-stuck-ever-given-blocking-orig-kj.cnn","Video shows effort to release container vessel stuck in Suez Canal"
"2021-03-26","202103261430","midday","https://www.cnn.com/2021/03/26/health/covid-war-doctors-sanjay-gupta/index.html","Redfield says, citing no clear evidence, he thinks the likely origin of the pandemic is a lab in China. Trump's Covid team spoke with Dr. Sanjay Gupta."
"2021-03-26","202103261430","midday","https://us.cnn.com/2021/03/26/health/us-coronavirus-friday/index.html","Dangerous Covid-19 variants could mean all bets are off on the road to normalcy, expert warns"
"2021-03-26","202103261430","midday","https://www.cnn.com/world/live-news/coronavirus-pandemic-vaccine-updates-03-26-21/h_7b977f0f508cf7310cc2139c58b5f922","GO THERE Dr. Sanjay Gupta answers your questions about the coronavirus pandemic"
"2021-03-26","202103261430","midday","https://us.cnn.com/videos/business/2021/03/26/anti-vaccine-mother-covid-19-misinformation-orig.cnn-business","She became an online influencer for her anti-vaccination stance. Now she's wants a Covid-19 shot"
"2021-03-26","202103261430","midday","https://us.cnn.com/2021/03/25/health/variants-eli-lilly-antibody-therapy-distribution-stops/index.html","US government stops distribution of Eli Lilly Covid-19 antibody treatment due to spread of coronavirus variants"
"2021-03-26","202103261430","midday","https://www.cnn.com/politics/live-news/georgia-voting-restrictions-bill-03-25-21/h_f7830a6516f53d90e47bca2ba99ea293","It's now a crime in Georgia to approach voters in line with food or water "
"2021-03-26","202103261430","midday","https://us.cnn.com/videos/us/2021/03/25/pelham-alabama-storm-video-sot-vpx.cnn","See dramatic video from inside Alabama tornado"
"2021-03-26","202103261430","midday","https://www.cnn.com/2021/03/26/media/dominion-voting-systems-fox-news-lawsuit/index.html","Breaking Dominion Voting Systems files $1.6 billion defamation lawsuit against Fox News"
"2021-03-26","202103261430","midday","https://us.cnn.com/2021/03/26/politics/donald-trump-january-6-rioters-arrests/index.html"," Trump lies about Capitol riot by claiming his supporters were 'hugging and kissing' cops"
"2021-03-26","202103261430","midday","https://us.cnn.com/2021/03/26/africa/egypt-train-collision-intl/index.html","More than 30 killed as trains collide in Egypt"
"2021-03-26","202103261430","midday","https://us.cnn.com/2021/03/26/us/atlanta-guns-supermarket-witness/index.html","An Instacart shopper saw an AR-15 in an Atlanta supermarket bathroom. Police arrested a man with 6 guns"
"2021-03-26","202103261430","midday","https://us.cnn.com/2021/03/25/politics/fact-check-biden-first-press-conference/index.html"," Fact-checking Biden's first news conference as president "
"2021-03-26","202103261430","midday","https://us.cnn.com/videos/us/2021/03/25/robert-e-lee-high-school-renaming-jacksonville-florida-orig-jk.cnn","Hear residents' shocking defense of Robert E. Lee's name on their high school"
"2021-03-26","202103261430","midday","https://us.cnn.com/2021/03/26/africa/tigray-ethiopia-eritrea-asmara-intl/index.html","Ethiopian Prime Minister says Eritrea will withdraw troops from Tigray"
"2021-03-26","202103261430","midday","https://us.cnn.com/2021/03/26/opinions/derek-chauvin-trial-importance-honig/index.html","Opinion: One of the most important trials America has ever seen is about to start"
"2021-03-26","202103261430","midday","https://us.cnn.com/2021/03/26/business/global-shipping-supply-chains/index.html","Global shipping was in chaos even before the Suez blockage"
"2021-03-26","202103261430","midday","https://us.cnn.com/videos/business-videos/2021/03/25/suez-canal-ship-stuck-ever-given-blocking-orig-kj.cnn","Video shows effort to release container vessel stuck in Suez Canal"
"2021-03-26","202103261430","midday","https://us.cnn.com/2021/03/26/perspectives/janet-yellen-minimum-global-tax-rate/index.html","Opinion: Why Janet Yellen is wrong on corporate tax rates"
"2021-03-26","202103261430","midday","https://us.cnn.com/videos/media/2021/03/25/ted-cruz-reporter-mask-vaccinations-sanjay-gupta-newday-sot-vpx.cnn","Ted Cruz refused request to wear a mask. Hear Gupta's response"
"2021-03-26","202103261840","evening","https://us.cnn.com/2021/03/26/politics/georgia-voting-law-two-photos/index.html","If you're trying to figure out the impact of the new voting restrictions, these two photos will tell you everything you need to know"
"2021-03-26","202103261840","evening","https://us.cnn.com/2021/03/25/politics/georgia-state-representative-arrested-governor-office/index.html","Georgia state lawmaker arrested protesting voting restriction bill "
"2021-03-26","202103261840","evening","https://www.cnn.com/politics/live-news/georgia-voting-restrictions-bill-03-25-21/h_7a563652ee371afb14d0e3c055f5d87e","Live Updates White House 'deeply concerned' about lawmaker's arrest"
"2021-03-26","202103261840","evening","https://us.cnn.com/videos/politics/2021/03/26/keilar-georgia-voting-law-big-lie-turned-into-voter-suppression-sot-vpx-nr.cnn","Keilar: Trump's big lie turns into voter suppression"
"2021-03-26","202103261840","evening","https://us.cnn.com/2021/03/26/politics/georgia-voter-suppression-law-trump-biden/index.html","Analysis: New law suppressing the vote is a victory for Trump"
"2021-03-26","202103261840","evening","https://us.cnn.com/2021/03/25/politics/georgia-state-house-voting-bill-passage/index.html","Georgia Republicans speed sweeping elections bill restricting voting access into law"
"2021-03-26","202103261840","evening","https://us.cnn.com/2021/03/25/opinions/voting-rights-suppression-is-jim-crow-suit-and-tie-hemmer/index.html","Opinion: What Jim Crow looks like in 2021"
"2021-03-26","202103261840","evening","https://www.cnn.com/2021/03/26/health/covid-war-doctors-sanjay-gupta/index.html","Ex-CDC boss believes Covid came from China lab; he cites no clear evidence"
"2021-03-26","202103261840","evening","https://us.cnn.com/2021/03/26/media/dominion-voting-systems-fox-news-lawsuit/index.html","Dominion Voting Systems files $1.6 billion lawsuit against Fox News"
"2021-03-26","202103261840","evening","https://www.cnn.com/2021/03/26/us/atlanta-guns-supermarket-witness/index.html","He heard what he believed was someone loading guns in a bathroom stall. Police arrested a man with 6 guns"
"2021-03-26","202103261840","evening","https://us.cnn.com/2021/03/26/weather/tornado-forecast-weekend-severe-threat/index.html","More tornadoes are possible in the South this weekend"
"2021-03-26","202103261840","evening","https://us.cnn.com/2021/03/26/us/weather-tornadoes-storms-friday/index.html","Severe storms hit the South, killing at least 6 and leaving heavy destruction"
"2021-03-26","202103261840","evening","https://us.cnn.com/videos/weather/2021/03/26/pelham-alabama-storm-video-sot-tsr-vpx.cnn","Dramatic video shows inside the tornado in Alabama"
"2021-03-26","202103261840","evening","https://us.cnn.com/2021/03/26/politics/joe-biden-first-news-conference-filibuster-timeline/index.html","Analysis: Biden lays out expansive theory of his own presidency"
"2021-03-26","202103261840","evening","https://us.cnn.com/2021/03/26/politics/nancy-pelosi-sergeant-at-arms-pick-william-walker/index.html","Pelosi appoints first Black House sergeant-at-arms, William J. Walker"
"2021-03-26","202103261840","evening","https://us.cnn.com/2021/03/26/politics/gayle-manchin-appalachian-regional-commission/index.html","Gayle Manchin nominated to be federal co-chair of Appalachian Regional Commission"
"2021-03-26","202103261840","evening","https://us.cnn.com/videos/us/2021/03/25/robert-e-lee-high-school-renaming-jacksonville-florida-orig-jk.cnn","Hear residents' shocking defense of Robert E. Lee's name on their high school"
"2021-03-26","202103261840","evening","https://us.cnn.com/2021/03/26/opinions/derek-chauvin-trial-importance-honig/index.html","Opinion: One of the most important trials America has ever seen is about to start"
"2021-03-26","202103261840","evening","https://us.cnn.com/2021/03/26/business/global-shipping-supply-chains/index.html","How the traffic jam in the Suez Canal could hit your wallet"
"2021-03-26","202103261840","evening","https://us.cnn.com/videos/business-videos/2021/03/25/suez-canal-ship-stuck-ever-given-blocking-orig-kj.cnn","Video shows effort to release container vessel stuck in Suez Canal"
"2021-03-26","202103261840","evening","https://us.cnn.com/2021/03/26/perspectives/janet-yellen-minimum-global-tax-rate/index.html","Opinion: Why Janet Yellen is wrong on corporate tax rates"
"2021-03-26","202103262328","late","https://us.cnn.com/2021/03/26/politics/trump-election-fraud-lie-georgia/index.html","Republicans didn't like the 2020 election results, so in Georgia they've changed the rules to try to keep it from happening again"
"2021-03-26","202103262328","late","https://us.cnn.com/2021/03/26/politics/georgia-voting-law-food-drink-ban-trnd/index.html","Georgia bans giving food and water to voters in line"
"2021-03-26","202103262328","late","https://us.cnn.com/2021/03/26/politics/joe-biden-georgia-voting-rights-bill/index.html","Biden says Justice Department is 'taking a look' at new Georgia elections law"
"2021-03-26","202103262328","late","https://us.cnn.com/2021/03/26/politics/georgia-voting-law-black-voters/index.html","Here's why voting rights activists say Georgia's new election law targets Black voters"
"2021-03-26","202103262328","late","https://us.cnn.com/2021/03/26/politics/georgia-voting-law-two-photos/index.html","Analysis: These two photos show who Georgia's new elections law benefits -- and hurts"
"2021-03-26","202103262328","late","https://us.cnn.com/videos/politics/2021/03/26/park-cannon-arrest-georgia-orig-jm.cnn","Park Cannon 'traumatized': Colleagues react to arrest outside governor's office"
"2021-03-26","202103262328","late","https://us.cnn.com/videos/politics/2021/03/26/georgia-voting-bill-don-lemon-sot-vpx-ctn.cnn","See Don Lemon's reaction to new Georgia voting law"
"2021-03-26","202103262328","late","https://us.cnn.com/2021/03/26/us/alabama-tornado-cross-trnd/index.html","Amid deadly Alabama tornadoes, a scarf-draped cross was spared"
"2021-03-26","202103262328","late","https://www.cnn.com/2021/03/26/health/covid-war-doctors-sanjay-gupta/index.html","Ex-CDC boss believes Covid came from China lab; he cites no clear evidence"
"2021-03-26","202103262328","late","https://www.cnn.com/2021/03/26/us/atlanta-guns-supermarket-witness/index.html","He heard what he believed was someone loading guns in a bathroom stall. Police arrested a man with 6 guns"
"2021-03-26","202103262328","late","https://us.cnn.com/2021/03/26/us/afraid-cnn-special-report/index.html","A quiet home and a lost wedding ring: How a mass shooting upended this family"
"2021-03-26","202103262328","late","https://us.cnn.com/2021/03/26/us/georgia-spa-shooting-victim-funeral-xiaojie-tan/index.html","At funeral of Georgia spa shooting victim, ex-husband says her relatives think US isn't safe. 'And who could blame them?'"
