"date","timestamp","session","href","txt"
"2021-03-27","202103271427","midday","https://www.theguardian.com/world/2021/mar/27/suez-canal-biden-help-oil-vessels-stuck-ship-ever-given","Suez canal  Biden offers help as some vessels head for Cape of Good Hope "
"2021-03-27","202103271427","midday","https://www.theguardian.com/tv-and-radio/2021/mar/27/sharon-osbourne-leaves-tv-show-after-row-about-meghan-and-piers-morgan","Sharon Osbourne  Presenter leaves TV show after row about Meghan and Piers Morgan  "
"2021-03-27","202103271840","evening","https://www.theguardian.com/world/2021/mar/27/data-still-supports-lifting-covid-19-restrictions-insists-boris-johnson","Coronavirus  Data still supports lifting restrictions, insists Boris Johnson "
"2021-03-27","202103271840","evening","https://www.theguardian.com/uk-news/2021/mar/27/boris-johnson-bristol-kill-the-bill-protest-violence-is-disgraceful","Bristol  Police under fire for 'assault' of journalist at protest "
"2021-03-27","202103271840","evening","https://www.theguardian.com/uk-news/2021/mar/27/home-office-revives-plan-to-deport-non-uk-rough-sleepers","Homelessness  Home Office revives plan to deport non-UK rough sleepers "
"2021-03-27","202103271840","evening","https://www.theguardian.com/world/2021/mar/27/salvager-raises-hopes-of-clearing-suez-canal-by-early-next-week","Suez canal  Salvager raises hopes of clearing route by early next week "
"2021-03-27","202103271840","evening","https://www.theguardian.com/politics/2021/mar/27/kenny-macaskill-quits-snp-to-join-alex-salmonds-alba-party","SNP  Kenny MacAskill quits party to join Alex Salmond's Alba party "
"2021-03-27","202103271840","evening","https://www.theguardian.com/world/2021/mar/27/myanmar-military-protesters-shot-armed-forces-day","Myanmar  More than 90 reported killed on 'day of shame' for armed forces  "
"2021-03-27","202103271840","evening","https://www.theguardian.com/world/2021/mar/27/mozambique-several-dead-as-insurgents-seize-control-of-town","Mozambique  Several dead as insurgents seize control of town "
"2021-03-27","202103271840","evening","https://www.theguardian.com/education/2021/mar/27/harvard-closes-evolution-center-after-finding-connections-jeffrey-epstein","Jeffrey Epstein  Harvard closes evolution centre after finding connections to disgraced financier "
"2021-03-27","202103271840","evening","https://www.theguardian.com/politics/2021/mar/27/brexit-uk-cheese-firm-boss-in-despair-over-ministers-export-advice","Brexit  UK cheese firm boss in despair over minister's export advice "
"2021-03-27","202103271840","evening","https://www.theguardian.com/tv-and-radio/2021/mar/27/sharon-osbourne-leaves-tv-show-after-row-about-meghan-and-piers-morgan","Sharon Osbourne  Presenter leaves TV show after row about Meghan and Piers Morgan  "
"2021-03-27","202103272328","late","https://www.theguardian.com/world/2021/mar/27/boris-johnson-branded-irresponsible-over-back-to-the-office-call","Coronavirus  Boris Johnson branded irresponsible over ‘back to the office’ call "
"2021-03-27","202103272328","late","https://www.theguardian.com/sport/2021/mar/27/wada-investigates-ukad-for-letting-british-cycling-conduct-doping-probe","Doping   Wada investigates Ukad for letting British Cycling conduct probe "
"2021-03-27","202103272328","late","https://www.theguardian.com/society/2021/mar/27/sexual-abuse-rife-in-state-schools-say-police","Sexual abuse  Problem rife in state schools, say police "
"2021-03-27","202103272328","late","https://www.theguardian.com/world/2021/mar/27/salvager-raises-hopes-of-clearing-suez-canal-by-early-next-week","Suez canal  Salvager raises hopes of clearing route by early next week "
"2021-03-27","202103272328","late","https://www.theguardian.com/uk-news/2021/mar/27/boris-johnson-bristol-kill-the-bill-protest-violence-is-disgraceful","Bristol  Police under fire for 'assault' of journalist at protest "
"2021-03-27","202103272328","late","https://www.theguardian.com/world/2021/mar/27/more-than-100-killed-as-myanmar-junta-unleashes-worst-day-of-terror","Myanmar  More than 100 killed as junta unleashes worst day of terror "
"2021-03-27","202103272328","late","https://www.theguardian.com/environment/2021/mar/27/uk-government-scraps-green-homes-grant-after-six-months","Green homes grant  Government scraps scheme after six months "
"2021-03-27","202103272328","late","https://www.theguardian.com/uk-news/2021/mar/27/met-police-hunt-man-charged-with-sexual-assault-released-in-error-from-prison","London  Met police hunt man charged with sexual assault released in error from prison "
"2021-03-27","202103272328","late","https://www.theguardian.com/uk-news/2021/mar/27/home-office-revives-plan-to-deport-non-uk-rough-sleepers","Homelessness  Home Office revives plan to deport non-UK rough sleepers "
"2021-03-27","202103272328","late","https://www.theguardian.com/uk-news/2021/mar/27/manchester-kill-the-bill-protesters-block-city-tram-lines","Manchester  'Kill the bill' protesters block city tram lines "
"2021-03-27","202103272328","late","https://www.theguardian.com/environment/2021/mar/27/global-landmarks-turn-off-the-lights-to-mark-annual-earth-hour","Earth Hour  Global landmarks turn off the lights to mark annual event  "
"2021-03-28","202103280930","morning","https://www.theguardian.com/world/live/2021/mar/28/coronavirus-live-news-germany-risks-losing-control-of-covid-brazil-deaths-top-3000-for-second-day","Live  Coronavirus: Moderna jab for under-50s in UK in April; Mexico death toll revised up by 60% "
"2021-03-28","202103280930","morning","https://www.theguardian.com/uk-news/2021/mar/28/protest-laws-move-uk-towards-paramilitary-policing-says-former-chief","Exclusive  Protest laws move UK towards paramilitary policing, says former chief "
"2021-03-28","202103280930","morning","https://www.theguardian.com/law/2021/mar/28/the-uk-professor-a-fake-russian-spy-and-the-undercover-syria-sting","'We never thought it would go this far'  The UK professor, a fake Russian spy and the undercover Syria sting "
"2021-03-28","202103280930","morning","https://www.theguardian.com/politics/2021/mar/28/labour-mps-raise-fears-over-keir-starmers-lack-of-grip","Labour   MPs raise fears over Keir Starmer's 'lack of grip' "
"2021-03-28","202103280930","morning","https://www.theguardian.com/world/2021/mar/28/defiant-johnson-tells-china-i-stand-behind-sanctioned-mps","China row  ‘I stand behind sanctioned MPs,’ says defiant Johnson "
"2021-03-28","202103280930","morning","https://www.theguardian.com/politics/2021/mar/28/alex-salmonds-alba-party-is-a-danger-to-the-union-says-top-tory","Scottish politics  Alex Salmond’s Alba party is a ‘danger’ to the union, says top Tory "
"2021-03-28","202103280930","morning","https://www.theguardian.com/society/2021/mar/27/sexual-abuse-rife-in-state-schools-say-police","Sexual abuse  Problem rife in state and private schools, say police "
"2021-03-28","202103280930","morning","https://www.theguardian.com/society/2021/mar/28/victims-in-84-of-online-grooming-cases-are-girls","Digital safety  Victims in 84% of online grooming cases are girls "
"2021-03-28","202103280930","morning","https://www.theguardian.com/uk-news/2021/mar/28/as-england-faces-2bn-council-tax-rise-nottingham-pays-highest-bill","Local government  As England faces £2bn council tax rise, Nottingham pays highest bill "
"2021-03-28","202103280930","morning","https://www.theguardian.com/world/2021/mar/28/britains-brutal-cuts-to-overseas-aid-put-african-science-projects-in-peril","Science  Britain’s ‘brutal’ cuts to overseas aid put African projects in peril "
"2021-03-28","202103280930","morning","https://www.theguardian.com/world/2021/mar/28/suez-canal-ever-given-stuck-ship-syria-rations-fuel","Suez canal  Syria 'rations' fuel as efforts to free stuck ship fail "
"2021-03-28","202103281426","midday","https://www.theguardian.com/education/2021/mar/28/uk-schools-record-more-than-60000-racist-incidents-five-years","Race in education  UK schools record more than 60,000 racist incidents in five years "
"2021-03-28","202103281426","midday","https://www.theguardian.com/global-development/2021/mar/28/fear-turns-to-fury-in-myanmar-as-children-shot-by-military","'Everyone is disgusted'  Fear turns to fury in Myanmar as children shot by military "
"2021-03-28","202103281426","midday","https://www.theguardian.com/society/2021/mar/28/moderna-covid-vaccine-to-be-introduced-in-uk-from-april","Covid vaccines  Moderna jab to be introduced in UK from April "
"2021-03-28","202103281426","midday","https://www.theguardian.com/world/2021/mar/28/saudi-arabia-has-spent-at-least-15bn-on-sportswashing-report-reveals","Exclusive  Saudi Arabia has spent at least $1.5bn on 'sportswashing', report reveals "
"2021-03-28","202103281426","midday","https://www.theguardian.com/politics/2021/mar/28/labour-mps-raise-fears-over-keir-starmers-lack-of-grip","Labour   MPs raise fears over Keir Starmer's 'lack of grip' "
"2021-03-28","202103281426","midday","https://www.theguardian.com/politics/2021/mar/28/nigel-farage-appointed-to-advisory-board-of-green-finance-firm","Nigel Farage  Ex-Ukip leader appointed to advisory board of green finance firm "
"2021-03-28","202103281426","midday","https://www.theguardian.com/uk-news/2021/mar/28/protest-laws-move-uk-towards-paramilitary-policing-says-former-chief","Police  Protest laws move UK towards paramilitary policing, says former chief "
"2021-03-28","202103281426","midday","https://www.theguardian.com/politics/2021/mar/28/second-snp-mp-defects-alex-salmond-alba-party","Scotland  Second SNP MP defects to Alex Salmond's Alba party "
"2021-03-28","202103281426","midday","https://www.theguardian.com/sport/live/2021/mar/28/bahrain-grand-prix-f1-season-opener-live","Live  Bahrain Grand Prix: F1 season opener  "
"2021-03-28","202103281426","midday","https://www.theguardian.com/business/2021/mar/28/a-kick-in-the-teeth-british-gas-engineers-face-losing-their-jobs-or-longer-working-hours","‘A kick in the teeth’  British Gas engineers face losing their jobs or longer working hours "
"2021-03-28","202103281426","midday","https://www.theguardian.com/business/2021/mar/28/most-britons-have-given-up-hope-of-holiday-abroad-in-2021","Covid travel  Most Britons have given up hope of holiday abroad in 2021 "
"2021-03-28","202103281840","evening","https://www.theguardian.com/uk-news/2021/mar/28/racial-justice-is-key-to-effective-policing-says-npcc-chief-martin-hewitt","Race and policing  Crisis damaging our legitimacy and effectiveness, says NPCC chief "
"2021-03-28","202103281840","evening","https://www.theguardian.com/society/2021/mar/28/dfe-warns-schools-could-be-closed-over-culture-claims","'Rape culture'  DfE warns schools could be closed over website claims "
"2021-03-28","202103281840","evening","https://www.theguardian.com/education/2021/mar/28/uk-schools-record-more-than-60000-racist-incidents-five-years","Education  UK schools record more than 60,000 racist incidents in five years "
"2021-03-28","202103281840","evening","https://www.theguardian.com/society/2021/mar/28/moderna-covid-vaccine-to-be-introduced-in-uk-from-april","Covid vaccines  Moderna jab to be introduced in UK from April "
"2021-03-28","202103281840","evening","https://www.theguardian.com/world/2021/mar/28/kurdish-forces-enter-refugee-camp-in-syria-to-eliminate-isis-cells","Syria  Kurdish forces enter refugee camp to eliminate Isis cells "
"2021-03-28","202103281840","evening","https://www.theguardian.com/world/2021/mar/28/saudi-arabia-has-spent-at-least-15bn-on-sportswashing-report-reveals","Exclusive  Saudi Arabia has spent at least $1.5bn on 'sportswashing', report reveals "
"2021-03-28","202103281840","evening","https://www.theguardian.com/global-development/2021/mar/28/fear-turns-to-fury-in-myanmar-as-children-shot-by-military","'Everyone is disgusted'  Fear turns to fury in Myanmar as children shot by military "
"2021-03-28","202103281840","evening","https://www.theguardian.com/society/2021/mar/28/gps-prefer-to-see-patients-face-to-face-says-uk-family-doctors-leader","'Like working in a call centre'  GPs prefer to see patients face to face, says doctors' leader "
"2021-03-28","202103281840","evening","https://www.theguardian.com/politics/2021/mar/28/nigel-farage-appointed-to-advisory-board-of-green-finance-firm","Nigel Farage  Ex-Ukip leader appointed to advisory board of green finance firm "
"2021-03-28","202103281840","evening","https://www.theguardian.com/business/2021/mar/28/a-kick-in-the-teeth-british-gas-engineers-face-losing-their-jobs-or-longer-working-hours","‘A kick in the teeth’  British Gas engineers face losing their jobs or longer working hours "
"2021-03-28","202103281840","evening","https://www.theguardian.com/politics/2021/mar/28/museum-of-brexit-campaigners-fundraising-charitable-status","Museum of Brexit  Leavers seek to raise £1m for site to tell 'balanced' story "
"2021-03-28","202103282328","late","https://www.theguardian.com/uk-news/2021/mar/28/racial-justice-is-key-to-effective-policing-says-npcc-chief-martin-hewitt","Race and policing  Crisis damaging our legitimacy and effectiveness, says NPCC chief "
"2021-03-28","202103282328","late","https://www.theguardian.com/society/2021/mar/28/dfe-warns-schools-could-be-closed-over-culture-claims","'Rape culture'  DfE warns schools could be closed over website claims "
"2021-03-28","202103282328","late","https://www.theguardian.com/world/2021/mar/28/johnson-urges-caution-as-england-takes-first-big-step-out-of-lockdown","Coronavirus  Johnson urges caution as England takes first big step out of lockdown "
"2021-03-28","202103282328","late","https://www.theguardian.com/education/2021/mar/28/uk-schools-record-more-than-60000-racist-incidents-five-years","Education  UK schools record more than 60,000 racist incidents in five years "
"2021-03-28","202103282328","late","https://www.theguardian.com/business/2021/mar/29/small-business-exports-fall-eu-survey-brexit","'Nightmare'  Small firms report large fall in exports to EU since Brexit "
"2021-03-28","202103282328","late","https://www.theguardian.com/world/2021/mar/28/kurdish-forces-enter-refugee-camp-in-syria-to-eliminate-isis-cells","Syria  Kurdish forces enter detention camp to eliminate Isis cells "
"2021-03-28","202103282328","late","https://www.theguardian.com/global-development/2021/mar/28/fear-turns-to-fury-in-myanmar-as-children-shot-by-military","'Everyone is disgusted'  Fear turns to fury in Myanmar as children shot by military "
"2021-03-28","202103282328","late","https://www.theguardian.com/world/2021/mar/28/mozambique-up-to-60-missing-after-insurgents-attack-convoy","Mozambique  Scores of people missing after insurgents attack convoy "
"2021-03-28","202103282328","late","https://www.theguardian.com/society/2021/mar/28/gps-prefer-to-see-patients-face-to-face-says-uk-family-doctors-leader","'Like working in a call centre'  GPs prefer to see patients face to face, says doctors' leader "
"2021-03-28","202103282328","late","https://www.theguardian.com/uk-news/2021/mar/28/teenage-girl-in-critical-condition-after-met-police-chase-collision","London  Teenage girl in critical condition after Met police chase collision "
"2021-03-28","202103282328","late","https://www.theguardian.com/business/2021/mar/28/a-kick-in-the-teeth-british-gas-engineers-face-losing-their-jobs-or-longer-working-hours","‘A kick in the teeth’  British Gas engineers face losing their jobs or longer working hours "
"2021-03-29","202103290946","morning","https://www.theguardian.com/politics/live/2021/mar/29/uk-covid-live-news-england-lockdown-latest-updates-boris-johnson-coronavirus","Live  UK Covid: 'fresh air' safety message highlights No 10 concerns about rule-breaking as England eases lockdown "
"2021-03-29","202103290946","morning","https://www.theguardian.com/world/2021/mar/29/suez-canal-attempt-re-float-ever-given-delay-salvage-tugboats","Suez canal  Ever Given ship partially refloated but bow still stuck  "
"2021-03-29","202103290946","morning","https://www.theguardian.com/world/2021/mar/29/watchdog-steps-in-secrecy-uk-women-syria-stripped-of-citizenship","Exclusive  Watchdog steps in over secrecy about UK women in Syria stripped of citizenship "
"2021-03-29","202103290946","morning","https://www.theguardian.com/business/2021/mar/29/small-business-exports-fall-eu-survey-brexit","'Nightmare'  Small firms report large fall in exports to EU since Brexit "
"2021-03-29","202103290946","morning","https://www.theguardian.com/society/2021/mar/29/parents-should-report-own-children-to-police-for-sexual-assault-says-chief-constable","'Rape culture'  Parents should report own children to police for sexual assault, says chief constable "
"2021-03-29","202103290946","morning","https://www.theguardian.com/environment/2021/mar/29/uk-urged-take-lead-helping-poor-countries-fund-climate-action-cop26","Cop26  UK urged to take lead in helping poor countries fund climate action "
"2021-03-29","202103290946","morning","https://www.theguardian.com/us-news/2021/mar/29/czech-republics-richest-man-dies-in-alaska-helicopter-crash-during-ski-trip","US  Czech Republic's richest man dies in Alaska helicopter crash "
"2021-03-29","202103290946","morning","https://www.theguardian.com/politics/2021/mar/29/last-thing-we-need-is-a-cosy-consensus-on-climate-crisis-warns-ed-miliband","Climate crisis  Ed Miliband says 'cosy consensus' is last thing we need "
"2021-03-29","202103290946","morning","https://www.theguardian.com/law/2021/mar/29/legal-challenge-seeks-stop-ministers-sending-disappearing-messages-whatsapp","'Democracy backwards'  Legal challenge seeks to stop ministers sending disappearing messages "
"2021-03-29","202103290946","morning","https://www.theguardian.com/music/2021/mar/29/alabama-shakes-drummer-steven-william-johnson-arrested-on-child-abuse-charges","Alabama Shakes  Drummer Steven William Johnson arrested on child abuse charges "
"2021-03-29","202103290946","morning","https://www.theguardian.com/books/2021/mar/29/italians-defend-dante-from-claims-he-was-light-years-behind-shakespeare","Dante  Italians bridle at claim that 'father' of their language was 'light years' behind Shakespeare "
"2021-03-29","202103291426","midday","https://www.theguardian.com/world/2021/mar/29/suez-canal-attempt-re-float-ever-given-delay-salvage-tugboats","Suez canal  Ever Given container ship freed after a week "
"2021-03-29","202103291426","midday","https://www.theguardian.com/us-news/live/2021/mar/29/derek-chauvin-trial-george-floyd-minneapolis-joe-biden-coronavirus-live","Live  US: Derek Chauvin trial to begin as George Floyd's brother calls killing 'modern day lynching' "
"2021-03-29","202103291426","midday","https://www.theguardian.com/politics/live/2021/mar/29/uk-covid-live-news-england-lockdown-latest-updates-boris-johnson-coronavirus","Live  UK Covid: Hancock says 'door not shut' on holidays abroad; 'fresh air' message as England loosens lockdown "
"2021-03-29","202103291426","midday","https://www.theguardian.com/uk-news/2021/mar/29/council-prioritised-cost-over-safety-grenfell-tower-inquiry-hears","Grenfell Tower fire  Council 'prioritised cost over safety', inquiry hears "
"2021-03-29","202103291426","midday","https://www.theguardian.com/politics/2021/mar/29/boris-johnsons-race-commission-to-scrap-use-of-bame-label","Politics  Boris Johnson's race commission 'to scrap use of BAME label' "
"2021-03-29","202103291426","midday","https://www.theguardian.com/politics/2021/mar/29/starmer-backs-shadow-chancellor-amid-reshuffle-rumours","Labour  Starmer backs shadow chancellor amid reshuffle rumours "
"2021-03-29","202103291426","midday","https://www.theguardian.com/society/2021/mar/29/parents-should-report-own-children-to-police-for-sexual-assault-says-chief-constable","'Rape culture'  Parents should report own children to police for sexual assault, says chief constable "
"2021-03-29","202103291426","midday","https://www.theguardian.com/politics/2021/mar/29/nigel-farage-green-employer-qanon-john-mappin","Nigel Farage  Green employer is part-owned by QAnon supporter "
"2021-03-29","202103291426","midday","https://www.theguardian.com/world/2021/mar/29/french-pharma-firm-found-guilty-over-medical-scandal-in-which-up-to-2000-died","France  Pharma firm found guilty over medical scandal in which up to 2,000 died "
"2021-03-29","202103291426","midday","https://www.theguardian.com/money/2021/mar/29/britons-pay-back-most-on-debt-in-27-years-as-credit-card-spending-slumps-covid","Money  Britons pay back most on debt in 27 years as credit card spending slumps "
"2021-03-29","202103291426","midday","https://www.theguardian.com/us-news/2021/mar/29/donald-trump-wedding-speech-mar-a-lago","Donald Trump  US ex-president grabs mic at wedding to toast himself ... and happy couple "
"2021-03-29","202103291839","evening","https://www.theguardian.com/us-news/live/2021/mar/29/derek-chauvin-trial-george-floyd-minneapolis-joe-biden-coronavirus-live","Live  US: Derek Chauvin trial begins as jury hears of 'excessive force' that took George Floyd's life "
"2021-03-29","202103291839","evening","https://www.theguardian.com/world/2021/mar/29/britons-in-spain-face-three-month-visa-free-limit-under-post-brexit-rules","Brexit  Spain denies reports it will round up and deport Britons without visas "
"2021-03-29","202103291839","evening","https://www.theguardian.com/world/2021/mar/29/uk-strikes-deal-gsk-doses-novavax-covid-vaccine","Novavax  UK to make up to 60m doses of vaccine under GSK deal "
"2021-03-29","202103291839","evening","https://www.theguardian.com/world/2021/mar/29/suez-canal-attempt-re-float-ever-given-delay-salvage-tugboats","Suez canal  Ever Given container ship freed after a week "
"2021-03-29","202103291839","evening","https://www.theguardian.com/politics/2021/mar/29/pm-has-no-case-to-answer-over-jennifer-arcuri-allegations-says-no-10","Boris Johnson  PM has 'no case to answer' over Jennifer Arcuri allegations, says No 10 "
"2021-03-29","202103291839","evening","https://www.theguardian.com/politics/2021/mar/29/nigel-farage-green-employer-qanon-john-mappin","Nigel Farage  Green employer is part-owned by QAnon believer "
"2021-03-29","202103291839","evening","https://www.theguardian.com/uk-news/2021/mar/29/two-suspended-after-lockdown-breach-by-east-midlands-hunt","Hunting  Two suspended after 'lockdown breach' by east Midlands hunt "
"2021-03-29","202103291839","evening","https://www.theguardian.com/politics/2021/mar/29/cameron-blocked-rule-change-that-left-open-door-for-him-to-lobby-for-greensill","David Cameron  Former PM blocked rule change, leaving him 'open door' to lobby for Greensill "
"2021-03-29","202103291839","evening","https://www.theguardian.com/world/2021/mar/29/isis-claims-deadly-attack-in-northern-mozambique","Mozambique  Isis claims responsibility for deadly attack in northern town "
"2021-03-29","202103291839","evening","https://www.theguardian.com/society/2021/mar/29/autism-more-common-in-children-in-england-than-previously-thought-study","England  Autism more common in children than previously thought – study "
"2021-03-29","202103291839","evening","https://www.theguardian.com/society/2021/mar/29/looking-up-health-symptoms-online-less-harmful-than-thought-study-says","Health  Looking up symptoms online less harmful than thought, study says "
"2021-03-30","202103300931","morning","https://www.theguardian.com/world/2021/mar/30/global-treaty-needed-to-protect-states-from-pandemics-say-world-leaders","‘Nobody is safe until everyone is safe’  Leaders urge global pandemic treaty "
"2021-03-30","202103300931","morning","https://www.theguardian.com/society/2021/mar/30/ministers-dropped-the-ball-on-sexual-violence-in-schools-says-labour","Labour  Ministers dropped the ball on sexual violence in schools, says Jess Phillips "
"2021-03-30","202103300931","morning","https://www.theguardian.com/environment/2021/mar/30/uk-criticised-for-ignoring-paris-climate-goals-in-infrastructure-decisions","Climate crisis  UK criticised for ignoring Paris climate goals in infrastructure decisions "
"2021-03-30","202103300931","morning","https://www.theguardian.com/world/2021/mar/30/eu-children-in-uk-care-system-could-become-undocumented-adults-charity-warns","Brexit  Fears of EU children in UK care becoming 'undocumented' adults "
"2021-03-30","202103300931","morning","https://www.theguardian.com/business/2021/mar/30/goldman-snacks-bank-sends-hampers-to-staff-amid-inhumane-working-hours","Goldman snacks  Bank sends hampers to staff amid 'inhumane' working hours "
"2021-03-30","202103300931","morning","https://www.theguardian.com/world/2021/mar/30/hong-kong-china-brings-in-voting-system-changes","Hong Kong  Beijing slashes directly elected seats in radical overhaul  "
"2021-03-30","202103300931","morning","https://www.theguardian.com/us-news/2021/mar/29/ghislaine-maxwell-new-charges-jeffrey-epstein","Ghislaine Maxwell   British socialite faces new charges, including sex trafficking of a minor "
"2021-03-30","202103300931","morning","https://www.theguardian.com/uk-news/2021/mar/30/richard-okorogheye-appeal-missing-student-london","Richard Okorogheye  Appeal for help to find 'struggling' London student  "
"2021-03-30","202103300931","morning","https://www.theguardian.com/society/2021/mar/30/120m-in-contracts-to-house-teens-in-care-on-offer-despite-concerns","Care  £120m in contracts to house teens in care on offer despite concerns "
"2021-03-30","202103300931","morning","https://www.theguardian.com/world/2021/mar/30/britons-in-france-could-lose-driving-licences-due-to-post-brexit-impasse","Brexit  Britons in France could lose driving licences "
"2021-03-30","202103300931","morning","https://www.theguardian.com/world/2021/mar/29/david-lammy-praised-for-response-to-lbc-caller-who-said-he-was-not-english","David Lammy  MP praised for response to LBC caller who said he was 'not English' "
