"date","timestamp","session","href","txt"
"2021-03-30","202103301430","midday","https://www.theguardian.com/uk-news/2021/mar/30/police-handling-of-sarah-everard-vigil-appropriate-says-watchdog","Sarah Everard vigil  Police handling of event appropriate, says watchdog "
"2021-03-30","202103301430","midday","https://www.theguardian.com/uk-news/2021/mar/30/police-accused-of-using-shields-as-weapons-at-bristol-kill-the-bill-protest","Bristol  Police accused of using shields as weapons at 'kill the bill' protest "
"2021-03-30","202103301430","midday","https://www.theguardian.com/world/live/2021/mar/30/coronavirus-live-news-who-to-present-china-mission-findings-canada-pauses-astrazeneca-vaccine-for-under-55s","Live  Coronavirus: parts of Germany pause AstraZeneca shots for under-60s as Canada halts jab for under-55s "
"2021-03-30","202103301430","midday","https://www.theguardian.com/world/2021/mar/30/climate-crisis-likely-cause-of-early-cherry-blossom-in-japan","Japan  Climate crisis 'likely cause' of early cherry blossom "
"2021-03-30","202103301430","midday","https://www.theguardian.com/uk-news/2021/mar/30/dawn-sturgess-novichok-death-inquest-to-look-at-role-of-russian-state","Dawn Sturgess  Novichok death inquest to look at role of Russian state "
"2021-03-30","202103301430","midday","https://www.theguardian.com/society/2021/mar/30/ministers-dropped-the-ball-on-sexual-violence-in-schools-says-labour","Labour  Ministers dropped the ball on sexual violence in schools, says Jess Phillips "
"2021-03-30","202103301430","midday","https://www.theguardian.com/environment/2021/mar/30/uk-criticised-for-ignoring-paris-climate-goals-in-infrastructure-decisions","Climate crisis  UK criticised for ignoring Paris climate goals in infrastructure decisions "
"2021-03-30","202103301430","midday","https://www.theguardian.com/business/2021/mar/30/deliveroo-valuation-drops-1bn-ahead-of-london-flotation","Deliveroo  Valuation drops £1bn ahead of London flotation "
"2021-03-30","202103301430","midday","https://www.theguardian.com/film/2021/mar/30/sharon-stone-memoir-cancer-surgeon-enlarged-breasts-without-consent","Sharon Stone  Actor says cosmetic surgeon enlarged her breasts without consent "
"2021-03-30","202103301430","midday","https://www.theguardian.com/uk-news/2021/mar/30/man-jailed-for-life-after-stockport-of-wife-over-frozen-chips","Stockport  Man jailed for life after murder of wife over frozen chips "
"2021-03-30","202103301430","midday","https://www.theguardian.com/media/2021/mar/30/us-military-account-gibberish-tweet-viral-mystery","';l;;gmlzxssaw'  US military account's gibberish tweet prompts viral mystery "
"2021-03-30","202103301844","evening","https://www.theguardian.com/world/2021/mar/30/who-criticises-chinas-data-sharing-as-it-releases-covid-origins-report","Coronavirus  UK and US criticise WHO's Covid report and accuse China of withholding data "
"2021-03-30","202103301844","evening","https://www.theguardian.com/us-news/2021/mar/30/derek-chauvin-trial-george-floyd-witness","George Floyd death  ‘I believed I witnessed a murder,’ witness says at Derek Chauvin trial "
"2021-03-30","202103301844","evening","https://www.theguardian.com/uk-news/2021/mar/30/report-into-policing-of-sarah-everard-vigil-a-missed-opportunity","Clapham Common  Report into policing of Sarah Everard vigil 'a missed opportunity' "
"2021-03-30","202103301844","evening","https://www.theguardian.com/education/2021/mar/30/turmoil-at-london-school-hit-by-flag-and-hairstyle-row","Pimlico Academy  Turmoil at London school hit by flag and hairstyle row "
"2021-03-30","202103301844","evening","https://www.theguardian.com/society/2021/mar/30/one-in-four-nhs-workers-more-likely-to-quit-than-a-year-ago-survey-finds","NHS  One in four workers more likely to quit than a year ago, survey finds "
"2021-03-30","202103301844","evening","https://www.theguardian.com/politics/2021/mar/30/johnson-has-case-to-answer-over-jennifer-arcuri-says-lawyer","Jennifer Arcuri  Johnson has case to answer, says lawyer "
"2021-03-30","202103301844","evening","https://www.theguardian.com/uk-news/2021/mar/30/uk-records-warmest-march-day-in-53-years-with-245c-temperatures","Weather  UK records warmest March day in 53 years with 24.5C temperatures "
"2021-03-30","202103301844","evening","https://www.theguardian.com/world/2021/mar/30/brazil-military-chiefs-resign-bolsonaro-fires-defense-minister","Brazil  Country on edge as three military chiefs resign after Bolsonaro fires defence minister "
"2021-03-30","202103301844","evening","https://www.theguardian.com/business/2021/mar/30/curse-of-ever-given-strikes-sussex-port-as-another-cargo-ship-goes-aground","Littlehampton  Curse of Ever Given strikes as another cargo ship goes aground "
"2021-03-30","202103301844","evening","https://www.theguardian.com/media/2021/mar/30/us-military-account-gibberish-tweet-viral-mystery","';l;;gmlxzssaw'  US military account's gibberish tweet prompts viral mystery "
"2021-03-30","202103302330","late","https://www.theguardian.com/education/2021/mar/30/ofsted-chief-asked-for-greater-powers-to-monitor-private-schools","Exclusive  Ofsted chief asked for greater powers to check for abuse in private schools "
"2021-03-30","202103302330","late","https://www.theguardian.com/world/2021/mar/31/uk-an-exemplar-of-racial-equality-no-10s-race-commission-concludes","Race  UK an exemplar of racial equality, No 10's commission concludes "
"2021-03-30","202103302330","late","https://www.theguardian.com/uk-news/2021/mar/30/police-handling-of-sarah-everard-vigil-appropriate-says-watchdog","Sarah Everard vigil  Report strongly defends police's use of force "
"2021-03-30","202103302330","late","https://www.theguardian.com/politics/2021/mar/30/business-card-puts-greensill-founder-at-the-heart-of-downing-street","Greensill   Business card puts founder at the heart of Downing Street "
"2021-03-30","202103302330","late","https://www.theguardian.com/uk-news/2021/mar/31/culture-without-crowds-uk-tourism-chiefs-tout-virtues-of-fall-in-foreign-visitors","'Culture without crowds'  UK tourism chiefs tout virtues of fall in foreign visitors "
"2021-03-30","202103302330","late","https://www.theguardian.com/uk-news/2021/mar/30/archbishop-of-canterbury-harry-and-meghans-legal-wedding-was-on-saturday","Harry and Meghan  Legal wedding was on Saturday, says Archbishop of Canterbury "
"2021-03-30","202103302330","late","https://www.theguardian.com/politics/2021/mar/30/johnson-has-case-to-answer-over-jennifer-arcuri-says-lawyer","Jennifer Arcuri  Johnson has case to answer, says lawyer "
"2021-03-30","202103302330","late","https://www.theguardian.com/education/2021/mar/30/turmoil-at-london-school-hit-by-flag-and-hairstyle-row","Pimlico academy  Turmoil at London school hit by flag and hairstyle row "
"2021-03-30","202103302330","late","https://www.theguardian.com/world/2021/mar/30/who-criticises-chinas-data-sharing-as-it-releases-covid-origins-report","Coronavirus  UK and US criticise WHO's Covid report and accuse China of withholding data "
"2021-03-30","202103302330","late","https://www.theguardian.com/us-news/2021/mar/30/derek-chauvin-trial-george-floyd-witness","Derek Chauvin trial  Teen who filmed killing tells court George Floyd was 'begging for his life' "
"2021-03-30","202103302330","late","https://www.theguardian.com/business/2021/mar/30/curse-of-ever-given-strikes-sussex-port-as-another-cargo-ship-goes-aground","Littlehampton  Echoes of Ever Given as another cargo ship goes aground "
"2021-03-31","202103310930","morning","https://www.theguardian.com/world/2021/mar/31/uk-an-exemplar-of-racial-equality-no-10s-race-commission-concludes","Race  UK an exemplar of racial equality, No 10's commission concludes "
"2021-03-31","202103310930","morning","https://www.theguardian.com/science/2021/mar/31/uk-scientists-funding-cuts-grants-foreign-aid","Science  UK funding cuts having 'catastrophic' impact "
"2021-03-31","202103310930","morning","https://www.theguardian.com/world/2021/mar/31/elite-minority-frequent-flyers-aviation-climate-damage-flights-environmental","Air transport  Minority who fly frequently 'cause most plane emissions' "
"2021-03-31","202103310930","morning","https://www.theguardian.com/music/2021/mar/31/britney-spears-responds-to-documentary-about-her-life-framing","'I cried for two weeks'  Britney Spears responds to documentary about her life "
"2021-03-31","202103310930","morning","https://www.theguardian.com/environment/2021/mar/31/urgent-policies-needed-steer-countries-net-zero-carbon-iea-chief-fatih-birol","Climate crisis  Urgent policies needed to steer countries to net zero, says IEA chief "
"2021-03-31","202103310930","morning","https://www.theguardian.com/uk-news/2021/mar/30/archbishop-of-canterbury-harry-and-meghans-legal-wedding-was-on-saturday","Meghan interview  Archbishop of Canterbury says legal wedding was on Saturday "
"2021-03-31","202103310930","morning","https://www.theguardian.com/business/live/2021/mar/31/uk-economy-gdp-2020-house-prices-lloyds-deliveroo-markets-ftse-gold-business-live","Live  Business: Deliveroo shares plunge on market debut "
"2021-03-31","202103310930","morning","https://www.theguardian.com/us-news/2021/mar/31/biden-promises-historic-2tn-spending-in-infrastructure-but-capitol-hill-fight-awaits","US  Biden promises 'historic' $2tn spending in infrastructure – but Capitol Hill fight awaits "
"2021-03-31","202103310930","morning","https://www.theguardian.com/politics/2021/mar/30/business-card-puts-greensill-founder-at-the-heart-of-downing-street","Greensill   Business card puts founder at the heart of Downing Street "
"2021-03-31","202103310930","morning","https://www.theguardian.com/world/2021/mar/31/bbc-journalist-john-sudworth-leaves-china-amid-criticism-of-networks-coverage","BBC  Journalist leaves China after Beijing criticises Uighurs coverage "
"2021-03-31","202103310930","morning","https://www.theguardian.com/science/2021/mar/31/dig-reveals-6000-year-old-salt-hub-in-north-yorkshire","Archaeology  Dig reveals 6,000-year-old salt hub in North Yorkshire  "
